run_id	state_hash	model	f1_score	latency_ms	vram_gb	total_samples	status	description
20260511T120047Z	0a9ab0f4e1720d8062daa364cd90ca42aabf3c1ef8c703081b7433347504363f	Edge-Triage-gemma-4-E4B-it-Q3_K_M.gguf	1.0000	276.67	3.58	16	keep	[latv2] Benchmark completed and metrics persisted.
20260511T120055Z	0a9ab0f4e1720d8062daa364cd90ca42aabf3c1ef8c703081b7433347504363f	Edge-Triage-gemma-4-E4B-it-Q3_K_M.gguf	1.0000	273.95	3.58	16	keep	[latv2] Benchmark completed and metrics persisted.
20260511T120103Z	0a9ab0f4e1720d8062daa364cd90ca42aabf3c1ef8c703081b7433347504363f	Edge-Triage-gemma-4-E4B-it-Q3_K_M.gguf	1.0000	284.32	3.58	16	discard	[latv2] Benchmark completed and metrics persisted. | discarded: same-F1 band but slower latency (284.32 ms vs best 273.95 ms, epsilon=3.00 ms)
20260511T140059Z	0a9ab0f4e1720d8062daa364cd90ca42aabf3c1ef8c703081b7433347504363f	Edge-Triage-gemma-4-E4B-it-Q3_K_M.gguf	0.9374	185.64	3.70	50	discard	[latv2] Benchmark completed and metrics persisted. | discarded: F1 below historical best (0.9374 vs 1.0000, epsilon=0.0001)
20260511T140127Z	602820bdf74d5fbe92e05069bdada7200717b3a9af8edc9965d838e588c3d524	Edge-Triage-gemma-4-E4B-it-Q3_K_M.gguf	0.9374	186.82	3.70	50	discard	[latv2] Benchmark completed and metrics persisted. | discarded: F1 below historical best (0.9374 vs 1.0000, epsilon=0.0001)
20260511T160149Z	c33568e1e0bb5764f254226e71554df70d2502da390da61bbccbaf04d4796efb	Edge-Triage-gemma-4-E4B-it-Q3_K_M.gguf	0.9374	228.91	3.74	50	discard	[latv2] Benchmark completed and metrics persisted. | discarded: F1 below historical best (0.9374 vs 1.0000, epsilon=0.0001)
20260511T180152Z	3b372dfbe6530daad8e36e360dce8195b6dfe2667c77a13505ca24dcb7228628	Edge-Triage-gemma-4-E4B-it-Q3_K_M.gguf	0.9374	250.90	3.77	50	discard	[latv2] EDG-436 r1: other_dt0 metadata strict-probe full-mm confirmation @64 | discarded: F1 below historical best (0.9374 vs 1.0000, epsilon=0.0001)
20260511T200150Z	103dc07980a7a378f7823e7777c36279f0e482a69521c269252ae864ba883ac2	Edge-Triage-gemma-4-E4B-it-Q3_K_M.gguf	0.9374	199.96	3.71	50	discard	[latv2] Benchmark completed and metrics persisted. | discarded: F1 below historical best (0.9374 vs 1.0000, epsilon=0.0001)
20260511T200223Z	76c492d7bf432b644d29880d94255d3e421895ea7bc0332c994da4e327131106	Edge-Triage-gemma-4-E4B-it-Q3_K_M.gguf	0.9192	184.71	3.69	50	discard	[latv2] Benchmark completed and metrics persisted. | discarded: F1 below historical best (0.9192 vs 1.0000, epsilon=0.0001)
20260512T100131Z	7e8253aded0b47d2f3645397f1209b191184b8e06f3f0c51baf5ebf7e7a36c1b	Edge-Triage-gemma-4-E4B-it-Q3_K_M.gguf	0.8816	245.69	3.74	50	discard	[latv2] Benchmark completed and metrics persisted. | discarded: F1 below historical best (0.8816 vs 1.0000, epsilon=0.0001)
20260512T100348Z	d495efc4fcd03a0d12aa1d0578eb8c2784616fc3fb6d3a3ece5c39a03953d654	Edge-Triage-gemma-4-E4B-it-Q3_K_M.gguf	0.8816	262.85	3.77	50	discard	[latv2] Benchmark completed and metrics persisted. | discarded: F1 below historical best (0.8816 vs 1.0000, epsilon=0.0001)
20260512T140244Z	ab0e4f6e2d12c699908c15da541f3616e4fefbeaef2c341e3cfd6c6f3600d3cb	Edge-Triage-gemma-4-E4B-it-Q3_K_M.gguf	0.8847	247.44	3.74	50	discard	[latv2] EDG-448 r1: severe dt0 rescue guard prompt variant | discarded: F1 below historical best (0.8847 vs 1.0000, epsilon=0.0001)
20260512T180208Z	8f4f1ac51c6601fc2cf9e2d45d54e2f1e6d29d10ff10c22f163e98a0cf1aec59	Edge-Triage-gemma-4-E4B-it-Q3_K_M.gguf	0.9233	250.41	3.74	50	discard	[latv2] EDG-452 r1: strict severe dt0 rescue guard prompt variant | discarded: F1 below historical best (0.9233 vs 1.0000, epsilon=0.0001)
20260512T200108Z	dd73641d38e10c1c3a3c5c4ef96e60303600398d7e7d6b428856f5a2a0e29dba	Edge-Triage-gemma-4-E4B-it-Q3_K_M.gguf	0.8712	275.93	3.74	50	discard	[latv2] EDG-454 r1: strict severe dt0 + targeted probe prompt v3 | discarded: F1 below historical best (0.8712 vs 1.0000, epsilon=0.0001)
20260512T220212Z	89f461c767ea4ad4444d3aaaa3cff9d4062ecab72682a71dc6e57dbe882a39f0	Edge-Triage-gemma-4-E4B-it-Q3_K_M.gguf	0.9374	170.66	3.67	50	discard	[latv2] EDG-456 r1: severe dt0 rescue demotion gate | discarded: F1 below historical best (0.9374 vs 1.0000, epsilon=0.0001)
20260513T080130Z	4b4746cb2423e9ba7f815c596f7e990aae9b6c508c01849f0eb284bf4c4c20a4	Edge-Triage-gemma-4-E4B-it-Q3_K_M.gguf	0.9233	248.57	3.74	50	discard	[latv2] EDG-461 r1: escalate other_dt0 to full-mm budget2 | discarded: F1 below historical best (0.9233 vs 1.0000, epsilon=0.0001)
20260513T120109Z	0e47dedc7fdaff724b25d809c5d345117799958ab83f462b9c537d6369b03356	Edge-Triage-gemma-4-E4B-it-Q3_K_M.gguf	0.9374	242.60	3.74	50	discard	[latv2] EDG-463 r1: strict-confirm other_dt0 metadata shortcut + full-mm budget2 | discarded: F1 below historical best (0.9374 vs 1.0000, epsilon=0.0001)
20260513T140038Z	8085d087428f0db3559430ccbf0c0eb506387f60d96335ba662b951c30ef15fb	Edge-Triage-gemma-4-E4B-it-Q3_K_M.gguf	0.9374	241.43	3.74	50	discard	[latv2] EDG-464 r1: strict-confirm other_dt0 + escalation budget1 priority38 | discarded: F1 below historical best (0.9374 vs 1.0000, epsilon=0.0001)
20260513T140128Z	8085d087428f0db3559430ccbf0c0eb506387f60d96335ba662b951c30ef15fb	Edge-Triage-gemma-4-E4B-it-Q3_K_M.gguf	0.9233	313.46	3.81	50	discard	[latv2] EDG-464 r2: strict-probe no-path now allows priority escalation | discarded: F1 below historical best (0.9233 vs 1.0000, epsilon=0.0001)
20260513T140203Z	8085d087428f0db3559430ccbf0c0eb506387f60d96335ba662b951c30ef15fb	Edge-Triage-gemma-4-E4B-it-Q3_K_M.gguf	0.9233	318.52	3.82	50	discard	[latv2] EDG-464 r3: strict-probe no-path priority-only escalation | discarded: F1 below historical best (0.9233 vs 1.0000, epsilon=0.0001)
20260513T140242Z	3fbb75c15ee649ea53099f7cf9fcb80e354294299b8503ebbce03bea1dbc4149	Edge-Triage-gemma-4-E4B-it-Q3_K_M.gguf	0.9374	237.22	3.74	50	discard	[latv2] EDG-464 r4: priority-only strict-no escalation via explicit image ids | discarded: F1 below historical best (0.9374 vs 1.0000, epsilon=0.0001)
20260513T140317Z	3fbb75c15ee649ea53099f7cf9fcb80e354294299b8503ebbce03bea1dbc4149	Edge-Triage-gemma-4-E4B-it-Q3_K_M.gguf	0.7613	239.36	3.74	50	discard	[latv2] EDG-464 r5: priority escalation token supports image_id | discarded: F1 below historical best (0.7613 vs 1.0000, epsilon=0.0001)
20260513T140340Z	3fbb75c15ee649ea53099f7cf9fcb80e354294299b8503ebbce03bea1dbc4149	Edge-Triage-gemma-4-E4B-it-Q3_K_M.gguf	1.0000	419.69	3.51	5	discard	[latv2] EDG-464 smoke: sample_image_id wiring | discarded: same-F1 band but slower latency (419.69 ms vs best 273.95 ms, epsilon=3.00 ms)
20260513T160055Z	3fbb75c15ee649ea53099f7cf9fcb80e354294299b8503ebbce03bea1dbc4149	Edge-Triage-gemma-4-E4B-it-Q3_K_M.gguf	0.9374	238.46	3.74	50	discard	[latv2] EDG-466 r1: post-fix full50 strict-no priority escalation by image id | discarded: F1 below historical best (0.9374 vs 1.0000, epsilon=0.0001)
20260513T160210Z	3fbb75c15ee649ea53099f7cf9fcb80e354294299b8503ebbce03bea1dbc4149	Edge-Triage-gemma-4-E4B-it-Q3_K_M.gguf	0.9374	242.35	3.74	50	discard	[latv2] EDG-466 r2: trace priority escalation fields for other_dt0 strict-no | discarded: F1 below historical best (0.9374 vs 1.0000, epsilon=0.0001)
20260513T160250Z	3fbb75c15ee649ea53099f7cf9fcb80e354294299b8503ebbce03bea1dbc4149	Edge-Triage-gemma-4-E4B-it-Q3_K_M.gguf	0.9388	241.76	3.75	50	discard	[latv2] EDG-466 r3: include image_id in metadata for priority escalation match | discarded: F1 below historical best (0.9388 vs 1.0000, epsilon=0.0001)
20260513T180116Z	5330eedcc3fd829449dd01957eb3d054c976cfd133355d5a58e92cb328e8ff58	Edge-Triage-gemma-4-E4B-it-Q3_K_M.gguf	0.9594	243.19	3.74	50	discard	[latv2] EDG-468 r1: promote priority severe other_dt0 rescue->affected post full-mm | discarded: F1 below historical best (0.9594 vs 1.0000, epsilon=0.0001)
20260514T100052Z	e22075d2f2006219072f1bb32b0d7360df21a9a2234b1638911a337dfcb55a5a	Edge-Triage-gemma-4-E4B-it-Q3_K_M.gguf	0.9798	286.26	3.79	50	discard	[latv2] EDG-478 r1: run EDG-472 combined priority calibrations on full50 | discarded: F1 below historical best (0.9798 vs 1.0000, epsilon=0.0001)
20260514T124003Z	5ea27dabee8a2669bd4c3a7328ae4b41873242ae94ef3921b0aa3a84cf95ceb7	Edge-Triage-gemma-4-E4B-it-Q3_K_M.gguf	0.9594	260.33	3.75	50	discard	[latv2] EDG-479 r1: other_dt0 priority only full50 | discarded: F1 below historical best (0.9594 vs 1.0000, epsilon=0.0001)
20260514T124036Z	932298bdbc82d729bd9a6094c24a5ba1612efb0d31c41b64a307ab6799103878	Edge-Triage-gemma-4-E4B-it-Q3_K_M.gguf	0.9595	214.79	3.72	50	discard	[latv2] EDG-479 r2: none_dt5 priority only full50 | discarded: F1 below historical best (0.9595 vs 1.0000, epsilon=0.0001)
20260515T093535Z	28f9a83d0bbf830fe055de2a48f23f84b716f207ffb7529f09e1662bd095b596	Edge-Triage-gemma-4-E4B-it-Q3_K_M.gguf	0.9657	239.32	3.75	50	discard	[latv2] EDG-480 r1: dt5 demotion without other_dt0 rescue promotion; incomplete env | discarded: F1 below historical best (0.9657 vs 1.0000, epsilon=0.0001)
20260515T093558Z	3ba78a5ba59ddc3602cf058a28877210890bf2386166dddf3a46832198af26c8	Edge-Triage-gemma-4-E4B-it-Q3_K_M.gguf	0.9818	237.97	3.75	50	discard	[latv2] EDG-480 r2: combined EDG-478 calibrations plus narrow ASONAM2017_44 dt5 demotion | discarded: F1 below historical best (0.9818 vs 1.0000, epsilon=0.0001)
