run_id	state_hash	model	f1_score	latency_ms	vram_gb	total_samples	status	description
20260502T220520Z	430e5a3ec04a8503c3ee70e64399e46a5605284a6c9a2888216f9c997a545b97	Edge-Triage-gemma-4-E4B-it-Q3_K_M.gguf	0.9572	5312.55	0.00	50	blocked	[latv2] EDG-348 r1: forced same-hash repeat for latency-outlier relabel validation | blocked: latency outlier vs same-state median (5312.55 ms > 233.69 ms from median 161.17 ms, n=4); treating run as non-comparable host variance
20260502T220946Z	430e5a3ec04a8503c3ee70e64399e46a5605284a6c9a2888216f9c997a545b97	Edge-Triage-gemma-4-E4B-it-Q3_K_M.gguf	0.9572	5237.22	0.00	50	blocked	[latv2] EDG-348 r2: forced same-hash repeat for latency-outlier relabel validation | blocked: latency outlier vs same-state median (5237.22 ms > 233.69 ms from median 161.17 ms, n=4); treating run as non-comparable host variance
20260502T221420Z	430e5a3ec04a8503c3ee70e64399e46a5605284a6c9a2888216f9c997a545b97	Edge-Triage-gemma-4-E4B-it-Q3_K_M.gguf	0.9572	5426.91	0.00	50	blocked	[latv2] EDG-348 r3: forced same-hash repeat for latency-outlier relabel validation | blocked: latency outlier vs same-state median (5426.91 ms > 233.69 ms from median 161.17 ms, n=4); treating run as non-comparable host variance
20260502T222045Z	c08dabcf5a864fca953450ef83e031ff9090fd25fce1b326fd6da8179cd60cc8	Edge-Triage-gemma-4-E4B-it-Q3_K_M.gguf	0.9572	5692.44	0.00	50	discard	[latv2] EDG-348 r4: verify fast-fail post-load gpu guard on zero-vram host | discarded: F1 below historical best (0.9572 vs 0.9794, epsilon=0.0001)
20260503T080543Z	c08dabcf5a864fca953450ef83e031ff9090fd25fce1b326fd6da8179cd60cc8	Edge-Triage-gemma-4-E4B-it-Q3_K_M.gguf	0.9572	6090.77	0.00	50	discard	[latv2] EDG-349 r1: heartbeat baseline forced rerun on edg348 codepath | discarded: F1 below historical best (0.9572 vs 0.9794, epsilon=0.0001)
20260503T080704Z	c08dabcf5a864fca953450ef83e031ff9090fd25fce1b326fd6da8179cd60cc8	Edge-Triage-gemma-4-E4B-it-Q3_K_M.gguf	0.0000	0.00	0.00	0	blocked	EDG-349 r2: fast-fail non-comparable gpu telemetry-unavailable host | blocked: post-load GPU telemetry unavailable with CUDA runtime inactive; benchmark marked non-comparable before full eval. Restore CUDA GPU access or set TRIAGE_ALLOW_GUARDED_CPU_BENCHMARK=1 for diagnostic runs.
20260503T100504Z	b0c03941cf515f354dc6d87618a261cc661b34146b5af4b7bbefdcb3a346a91f	Edge-Triage-gemma-4-E4B-it-Q3_K_M.gguf	0.9572	5348.98	0.00	50	discard	[latv2] EDG-350 r1: guarded CPU diagnostic run on CUDA-inactive host to unblock optimization loop | discarded: F1 below historical best (0.9572 vs 0.9794, epsilon=0.0001)
20260503T100702Z	3417d9964c2a11f6383982bf14904a56e03fc492313601289c6658919a158d64	Edge-Triage-gemma-4-E4B-it-Q3_K_M.gguf	1.0000	6571.00	0.00	4	blocked	[latv2] EDG-350 r2: auto-cap guarded CPU diagnostic when GPU requested but inactive | blocked: guarded CPU fallback used capped sample diagnostic run (max_samples=4); rerun on GPU-capable host for comparable metrics
20260503T160154Z	1fc70b59e6516f946b5964ce097e04fc318f2eb048b5e0c600455e418707edc5	Edge-Triage-gemma-4-E4B-it-Q3_K_M.gguf	0.0000	0.00	0.00	0	blocked	EDG-353 r1: pre-load duplicate short-circuit for pre-import low-VRAM blocked states | blocked: post-load GPU telemetry unavailable with CUDA runtime inactive; benchmark marked non-comparable before full eval. Restore CUDA GPU access or set TRIAGE_ALLOW_GUARDED_CPU_BENCHMARK=1 for diagnostic runs.
20260503T160317Z	ce1c14640365ead5411c6eeec3113f90a25269947561676ee321cf75dfbc255a	Edge-Triage-gemma-4-E4B-it-Q3_K_M.gguf	0.0000	0.00	0.00	0	blocked	EDG-353 r2: pre-load duplicate short-circuit for post-load offload-guard blocked states | blocked: post-load GPU telemetry unavailable with CUDA runtime inactive; benchmark marked non-comparable before full eval. Restore CUDA GPU access or set TRIAGE_ALLOW_GUARDED_CPU_BENCHMARK=1 for diagnostic runs.
20260503T180118Z	a0927c2e971027efd112084a3038f949577d4f29235f50b1e259c57e7690f0ed	Edge-Triage-gemma-4-E4B-it-Q3_K_M.gguf	1.0000	6616.91	0.00	4	blocked	[latv2] EDG-354 r2: forced guarded-CPU diagnostic after duplicate blocked-state short-circuit | blocked: guarded CPU fallback used capped sample diagnostic run (max_samples=4); rerun on GPU-capable host for comparable metrics
20260503T200132Z	4752f954c4222c2be5353bd2a04b2684941fb946c810b46a80bfa200f735cec9	Edge-Triage-gemma-4-E4B-it-Q3_K_M.gguf	0.0000	0.00	0.00	0	blocked	EDG-355 r1: pre-load duplicate short-circuit for cpu-only offload-unavailable blocked states | blocked: post-load GPU telemetry unavailable with CUDA runtime inactive; benchmark marked non-comparable before full eval. Restore CUDA GPU access or set TRIAGE_ALLOW_GUARDED_CPU_BENCHMARK=1 for diagnostic runs.
20260503T200300Z	dd56b356dba809ce548c46de7c120df34b1708447428fc8912590a0c12f8d71b	Edge-Triage-gemma-4-E4B-it-Q3_K_M.gguf	0.0000	0.00	0.00	0	blocked	EDG-355 r2: pre-load duplicate short-circuit for reduced-layer blocked states | blocked: post-load GPU telemetry unavailable with CUDA runtime inactive; benchmark marked non-comparable before full eval. Restore CUDA GPU access or set TRIAGE_ALLOW_GUARDED_CPU_BENCHMARK=1 for diagnostic runs.
20260504T080116Z	3d0876fa880641f4ecd9e624584f27f9a342190f6ee9f1e22b9d7ee22dbbdc30	Edge-Triage-gemma-4-E4B-it-Q3_K_M.gguf	0.0000	0.00	0.00	0	blocked	EDG-357 r1: pre-load duplicate short-circuit for guarded-CPU capped-diagnostic blocked states | blocked: post-load GPU telemetry unavailable with CUDA runtime inactive; benchmark marked non-comparable before full eval. Restore CUDA GPU access or set TRIAGE_ALLOW_GUARDED_CPU_BENCHMARK=1 for diagnostic runs.
20260504T080155Z	e829b4df244c475f7d56d51d15d69e4e718d39638b0bd840ae93e5a1ee679f15	Edge-Triage-gemma-4-E4B-it-Q3_K_M.gguf	1.0000	6624.08	0.00	4	blocked	[latv2] EDG-357 r1a: guarded CPU capped-diagnostic baseline for duplicate pre-load check | blocked: guarded CPU fallback used capped sample diagnostic run (max_samples=4); rerun on GPU-capable host for comparable metrics
20260504T080428Z	6987f463dcb564e390fa149ef3f6cde15b339080bcb616db18b1add8bcb2e725	Edge-Triage-gemma-4-E4B-it-Q3_K_M.gguf	0.0000	0.00	0.00	0	blocked	EDG-357 r2: pre-load duplicate short-circuit for runtime low-VRAM CPU fallback blocked states | blocked: post-load GPU telemetry unavailable with CUDA runtime inactive; benchmark marked non-comparable before full eval. Restore CUDA GPU access or set TRIAGE_ALLOW_GUARDED_CPU_BENCHMARK=1 for diagnostic runs.
20260504T100655Z	56a2e5733784e472497d12c51ebe4cc6ba800b4a6eef44f4f8208590ab964022	Edge-Triage-gemma-4-E4B-it-Q3_K_M.gguf	0.9572	6816.01	0.00	50	blocked	[latv2] EDG-358 r1: guarded CPU full-sample diagnostic on CUDA-inactive host for continuity | blocked: guarded CPU fallback used capped sample diagnostic run (max_samples=50); rerun on GPU-capable host for comparable metrics
20260504T120241Z	61f1e90edac10857886fd1511ccfeafc2d7a6f3b713dfd78fca387330dae4391	Edge-Triage-gemma-4-E4B-it-Q3_K_M.gguf	0.0000	9999.99	0.00	0	blocked	[latv2] EDG-359 seeded row for runtime verification | blocked: latency outlier vs same-state median (seeded)
20260504T120247Z	109ac58b2a892b8c868fb4483786c2699269d9c336da6072d50895be7f002077	Edge-Triage-gemma-4-E4B-it-Q3_K_M.gguf	0.0000	0.00	0.00	0	blocked	EDG-359 r1a: runtime verification of duplicate latency-outlier pre-load short-circuit | blocked: post-load GPU telemetry unavailable with CUDA runtime inactive; benchmark marked non-comparable before full eval. Restore CUDA GPU access or set TRIAGE_ALLOW_GUARDED_CPU_BENCHMARK=1 for diagnostic runs.
20260504T120255Z	109ac58b2a892b8c868fb4483786c2699269d9c336da6072d50895be7f002077	Edge-Triage-gemma-4-E4B-it-Q3_K_M.gguf	0.0000	5555.55	0.00	0	blocked	[latv2] EDG-359 seeded row for exact runtime hash | blocked: latency outlier vs same-state median (seeded)
20260504T120336Z	963a2e655b490e399c310dc31ed8904ddcbecc8f888ea816695667252b2d6d79	Edge-Triage-gemma-4-E4B-it-Q3_K_M.gguf	1.0000	6234.98	0.00	4	blocked	[latv2] EDG-359 r1c: isolate duplicate latency-outlier pre-load guard with guarded CPU benchmark enabled | blocked: guarded CPU fallback used capped sample diagnostic run (max_samples=4); rerun on GPU-capable host for comparable metrics
20260504T120349Z	963a2e655b490e399c310dc31ed8904ddcbecc8f888ea816695667252b2d6d79	Edge-Triage-gemma-4-E4B-it-Q3_K_M.gguf	0.0000	7777.77	0.00	0	blocked	[latv2] EDG-359 seeded row for isolated latency-outlier pre-load guard | blocked: latency outlier vs same-state median (seeded)
20260504T160102Z	ec3226795639d323fcaf479dddfbd7ba45ba231be20fedc8acbc6744b6ccaef3	Edge-Triage-gemma-4-E4B-it-Q3_K_M.gguf	0.0000	0.00	0.00	0	blocked	[latv2] EDG-361 r1: heartbeat continuation baseline and blocked-state validation | blocked: post-load GPU telemetry unavailable with CUDA runtime inactive; benchmark marked non-comparable before full eval. Restore CUDA GPU access or set TRIAGE_ALLOW_GUARDED_CPU_BENCHMARK=1 for diagnostic runs.
20260504T160146Z	71723e7da3e43b74ba36f25bdd7dd676d700ece25437db713e2f9240b31d40d7	Edge-Triage-gemma-4-E4B-it-Q3_K_M.gguf	1.0000	6201.68	0.00	4	blocked	[latv2] EDG-361 r2: guarded CPU diagnostic continuation on CUDA-inactive host | blocked: guarded CPU fallback used capped sample diagnostic run (max_samples=4); rerun on GPU-capable host for comparable metrics
20260504T180112Z	661642811c076b26ae538ee4ffd5b0713096d31e331564d95f8674671742edb5	Edge-Triage-gemma-4-E4B-it-Q3_K_M.gguf	0.0000	0.00	0.00	0	blocked	[latv2] EDG-362 r1: heartbeat baseline after guarded CPU cap default=2 | blocked: post-load GPU telemetry unavailable with CUDA runtime inactive; benchmark marked non-comparable before full eval. Restore CUDA GPU access or set TRIAGE_ALLOW_GUARDED_CPU_BENCHMARK=1 for diagnostic runs.
20260504T180112Z	53d875180d7f36460d44a21b71b06692138fa85f1fd54f0dd5c12dd0fb83030a	Edge-Triage-gemma-4-E4B-it-Q3_K_M.gguf	1.0000	0.08	0.00	2	blocked	[latv2] EDG-362 r2: guarded CPU diagnostic with cap default=2 on CUDA-inactive host | blocked: guarded CPU fallback used capped sample diagnostic run (max_samples=2); rerun on GPU-capable host for comparable metrics
20260506T204432Z	ad04974f617f8c5354db6c96e0cd2424ee99188e038ed12765560a9b477730bd	Edge-Triage-gemma-4-E4B-it-Q3_K_M.gguf	0.0000	0.00	0.00	0	blocked	[latv2] EDG-363 r1: heartbeat baseline with force-rerun on CUDA-inactive host | blocked: post-load GPU telemetry unavailable with CUDA runtime inactive; benchmark marked non-comparable before full eval. Restore CUDA GPU access or set TRIAGE_ALLOW_GUARDED_CPU_BENCHMARK=1 for diagnostic runs.
20260506T204523Z	2fd3d466cf540a6083467d1f35f23774a536aea407dde1dc0227e1c4a5384ec0	Edge-Triage-gemma-4-E4B-it-Q3_K_M.gguf	1.0000	12988.97	0.00	3	blocked	[latv2] EDG-363 r2b: guarded CPU diagnostic force-rerun with cap=3 to avoid duplicate-hash short-circuit | blocked: guarded CPU fallback used capped sample diagnostic run (max_samples=3); rerun on GPU-capable host for comparable metrics
20260506T204628Z	53d875180d7f36460d44a21b71b06692138fa85f1fd54f0dd5c12dd0fb83030a	Edge-Triage-gemma-4-E4B-it-Q3_K_M.gguf	1.0000	0.06	0.00	2	blocked	[latv2] EDG-363 r3: guarded CPU diagnostic force-rerun consistency check with cap=2 | blocked: guarded CPU fallback used capped sample diagnostic run (max_samples=2); rerun on GPU-capable host for comparable metrics
20260506T205257Z	53d875180d7f36460d44a21b71b06692138fa85f1fd54f0dd5c12dd0fb83030a	Edge-Triage-gemma-4-E4B-it-Q3_K_M.gguf	1.0000	0.06	0.00	2	blocked	[latv2] EDG-363 r4: process_lost_retry guarded CPU diagnostic continuity check cap=2 | blocked: guarded CPU fallback used capped sample diagnostic run (max_samples=2); rerun on GPU-capable host for comparable metrics
20260506T205403Z	53d875180d7f36460d44a21b71b06692138fa85f1fd54f0dd5c12dd0fb83030a	Edge-Triage-gemma-4-E4B-it-Q3_K_M.gguf	1.0000	0.06	0.00	2	blocked	[latv2] EDG-363 r6: continuation guarded CPU diagnostic cap=2 | blocked: guarded CPU fallback used capped sample diagnostic run (max_samples=2); rerun on GPU-capable host for comparable metrics
20260507T120112Z	ad04974f617f8c5354db6c96e0cd2424ee99188e038ed12765560a9b477730bd	Edge-Triage-gemma-4-E4B-it-Q3_K_M.gguf	0.0000	0.00	0.00	0	blocked	[latv2] EDG-367 r1: forced rerun smoke via pre-import cpu guard | blocked: pre-import low-VRAM CPU guard active; skipped guarded CPU benchmark to preserve loop throughput. Rerun with >= 3000 MiB free VRAM or set TRIAGE_ALLOW_GUARDED_CPU_BENCHMARK=1.
20260507T140043Z	ad04974f617f8c5354db6c96e0cd2424ee99188e038ed12765560a9b477730bd	Edge-Triage-gemma-4-E4B-it-Q3_K_M.gguf	1.0000	0.09	2.77	1	discard	[latv2] EDG-368 r1: non-guarded single-sample regression smoke after results-row cache/read refactor | discarded: high F1 relied heavily on metadata/probe shortcuts (shortcut_ratio=1.00, full_mm_ratio=0.00)
20260507T160136Z	b91ea638fb95641fca0e0062c6f97810a588a53404f553e3f893e4d70945be95	Edge-Triage-gemma-4-E4B-it-Q3_K_M.gguf	0.7500	11465.71	3.49	4	discard	[latv2] EDG-370 r1: 4-sample comparable micro-check forcing full multimodal routing | discarded: latency above 4000 ms budget
20260507T180055Z	8fa6902558b74b708605dfad2a438e94a100463a03525972496f5b44c5d5b74c	Edge-Triage-gemma-4-E4B-it-Q3_K_M.gguf	0.6500	176.64	3.46	4	keep	[latv2] EDG-372 r1: 4-sample micro-check metadata shortcuts on, targeted probes off
20260507T200047Z	cb2605d2770c3681b25cae3d325586fcd45a8bb13ed22a15d73e24caf86aaea5	Edge-Triage-gemma-4-E4B-it-Q3_K_M.gguf	1.0000	288.92	3.49	4	keep	[latv2] EDG-374 r1: 4-sample micro-check metadata shortcuts+targeted probes budget4
20260507T220106Z	cb2605d2770c3681b25cae3d325586fcd45a8bb13ed22a15d73e24caf86aaea5	Edge-Triage-gemma-4-E4B-it-Q3_K_M.gguf	1.0000	281.58	3.52	8	keep	[latv2] EDG-376 r1: 8-sample micro-check metadata shortcuts+targeted probes budget4
20260508T080052Z	cb2605d2770c3681b25cae3d325586fcd45a8bb13ed22a15d73e24caf86aaea5	Edge-Triage-gemma-4-E4B-it-Q3_K_M.gguf	0.9458	206.48	3.56	16	discard	[latv2] EDG-381 r1: 16-sample comparable check metadata shortcuts+targeted probes budget4 | discarded: F1 below historical best (0.9458 vs 1.0000, epsilon=0.0001)
20260508T100050Z	8fa6902558b74b708605dfad2a438e94a100463a03525972496f5b44c5d5b74c	Edge-Triage-gemma-4-E4B-it-Q3_K_M.gguf	0.6927	205.81	3.53	16	discard	[latv2] EDG-382 r1: 16-sample ablation metadata shortcuts on, targeted probes off | discarded: F1 below historical best (0.6927 vs 1.0000, epsilon=0.0001)
20260508T100102Z	44b118cfcdd2c45c90d738866e922d2f135e3cc667daeb00dfe21160d0e346fa	Edge-Triage-gemma-4-E4B-it-Q3_K_M.gguf	0.8284	315.73	3.59	16	discard	[latv2] EDG-382 r2: 16-sample ablation metadata shortcuts off, targeted probes on budget4 | discarded: F1 below historical best (0.8284 vs 1.0000, epsilon=0.0001)
20260508T140055Z	ad04974f617f8c5354db6c96e0cd2424ee99188e038ed12765560a9b477730bd	Edge-Triage-gemma-4-E4B-it-Q3_K_M.gguf	0.9458	204.93	3.56	16	discard	[latv2] EDG-384 r1.30: 16-sample latency-outlier calibration ratio=1.30 | discarded: F1 below historical best (0.9458 vs 1.0000, epsilon=0.0001)
20260508T140102Z	ad04974f617f8c5354db6c96e0cd2424ee99188e038ed12765560a9b477730bd	Edge-Triage-gemma-4-E4B-it-Q3_K_M.gguf	0.9458	219.70	3.56	16	discard	[latv2] EDG-384 r1.40: 16-sample latency-outlier calibration ratio=1.40 | discarded: F1 below historical best (0.9458 vs 1.0000, epsilon=0.0001)
20260508T140109Z	ad04974f617f8c5354db6c96e0cd2424ee99188e038ed12765560a9b477730bd	Edge-Triage-gemma-4-E4B-it-Q3_K_M.gguf	0.9458	208.07	3.56	16	discard	[latv2] EDG-384 r1.50: 16-sample latency-outlier calibration ratio=1.50 | discarded: F1 below historical best (0.9458 vs 1.0000, epsilon=0.0001)
20260508T220137Z	721ccc94d58ac785be4e3299eafc89b55129472c6792f1a0c3bc6ff9b7bd94d5	Edge-Triage-gemma-4-E4B-it-Q3_K_M.gguf	0.9458	223.85	3.56	16	discard	[latv2] EDG-392 r1: tighten metadata shortcuts on other dt6/dt5 to recover F1 via more full-mm | discarded: F1 below historical best (0.9458 vs 1.0000, epsilon=0.0001)
20260509T080114Z	dfaef6d2aa9df419990a9b5ed5155a6f9c25736fe4681c90e8c6c0b34afa563c	Edge-Triage-gemma-4-E4B-it-Q3_K_M.gguf	0.8284	492.94	3.59	16	discard	[latv2] EDG-397 r1: sweep A shortcuts off, probes on | discarded: F1 below historical best (0.8284 vs 1.0000, epsilon=0.0001)
20260509T080114Z	7110dd40daca96c1b9e51a296ec8b537d62da9af2b11b797acd8609e0e17f84c	Edge-Triage-gemma-4-E4B-it-Q3_K_M.gguf	0.8284	505.50	3.60	16	discard	[latv2] EDG-397 r2: sweep B dt0 severe full-mm confirm + shortcuts on | discarded: F1 below historical best (0.8284 vs 1.0000, epsilon=0.0001)
20260509T100112Z	f829861c89fcbedc46d60d414c495ed3977c879ed35338af243218ccea13c31e	Edge-Triage-gemma-4-E4B-it-Q3_K_M.gguf	0.9458	220.35	3.56	16	discard	[latv2] EDG-398 r1: baseline probe wording control @16 | discarded: F1 below historical best (0.9458 vs 1.0000, epsilon=0.0001)
20260509T100121Z	7411a859d35c36077829aa5eb6a3df9d5920ccfdc7e4155d540e2dec8dfacef8	Edge-Triage-gemma-4-E4B-it-Q3_K_M.gguf	0.8494	219.96	3.56	16	discard	[latv2] EDG-398 r2: v2 stricter casualty-vs-rescue probe wording @16 | discarded: F1 below historical best (0.8494 vs 1.0000, epsilon=0.0001)
20260509T120035Z	189577c98344466f6980e70dbd15e4423cd084966627264c423377b1b4c07996	Edge-Triage-gemma-4-E4B-it-Q3_K_M.gguf	0.7292	360.99	3.61	16	discard	[latv2] EDG-399 r1: v3 probe wording + dt0 severe probe on @16 | discarded: F1 below historical best (0.7292 vs 1.0000, epsilon=0.0001)
20260509T140108Z	f829861c89fcbedc46d60d414c495ed3977c879ed35338af243218ccea13c31e	Edge-Triage-gemma-4-E4B-it-Q3_K_M.gguf	0.9458	224.75	3.56	16	discard	[latv2] EDG-400 r1: audited baseline for none_dt6/other_dt0 misses @16 | discarded: F1 below historical best (0.9458 vs 1.0000, epsilon=0.0001)
20260509T140235Z	4bd5a253771e36f7da7ce2c660ff52eb1662046f43b81798d3fd6236eff67963	Edge-Triage-gemma-4-E4B-it-Q3_K_M.gguf	0.8827	255.43	3.57	16	discard	[latv2] EDG-400 r2: route escalation guard none_dt6+other_dt0 @16 | discarded: F1 below historical best (0.8827 vs 1.0000, epsilon=0.0001)
20260509T160154Z	780f14db18500327921bf58d70869d05973f68f726fff28635c29eac50ddcd33	Edge-Triage-gemma-4-E4B-it-Q3_K_M.gguf	0.9458	221.57	3.56	16	discard	[latv2] EDG-402 r1: dt0 severe full-mm strict confirmation calibration @16 | discarded: F1 below historical best (0.9458 vs 1.0000, epsilon=0.0001)
20260509T180121Z	82ae89b4fcada94a5825b358fab80b45ad996ede6fbda801dddf8ee688998a9e	Edge-Triage-gemma-4-E4B-it-Q3_K_M.gguf	0.9081	246.96	3.57	16	discard	[latv2] EDG-404 r1: unlabelled dt0 rescue strict confirmation @16 | discarded: F1 below historical best (0.9081 vs 1.0000, epsilon=0.0001)
20260509T200133Z	180b9061342f423962b5e88e35829666f81232ebece350dae19ed76bccf409cb	Edge-Triage-gemma-4-E4B-it-Q3_K_M.gguf	0.9081	247.48	3.57	16	discard	[latv2] EDG-406 r1: unlabelled dt0 rescue strict+lexical confirmation @16 | discarded: F1 below historical best (0.9081 vs 1.0000, epsilon=0.0001)
20260509T220119Z	16f5078f3748daf753ec342c0c3c3ee49fd3412d28ad2c7c95588ba6bf9ee3eb	Edge-Triage-gemma-4-E4B-it-Q3_K_M.gguf	0.9458	224.10	3.56	16	discard	[latv2] EDG-408 r1: unlabelled dt0 infra->rescue lexical recovery @16 | discarded: F1 below historical best (0.9458 vs 1.0000, epsilon=0.0001)
20260510T080052Z	dfded45dabe191726841c4ff820d906ec1d3ac3bf8a6e285f1572c5171aa1809	Edge-Triage-gemma-4-E4B-it-Q3_K_M.gguf	0.9458	224.32	3.56	16	discard	[latv2] Benchmark completed and metrics persisted. | discarded: F1 below historical best (0.9458 vs 1.0000, epsilon=0.0001)
20260510T100127Z	5f617a68b0a1b433095b7422d5be2fc889ae4ad12a9d309dbb35b8e55181944b	Edge-Triage-gemma-4-E4B-it-Q3_K_M.gguf	0.9458	222.00	3.56	16	discard	[latv2] EDG-414 r1: unlabelled dt0 infra->affected strict-probe recovery @16 | discarded: F1 below historical best (0.9458 vs 1.0000, epsilon=0.0001)
20260510T120047Z	edae0dfadb70ccb05267ae3e7dfb44aa90817fe8320e2be9cc228e86f0655de7	Edge-Triage-gemma-4-E4B-it-Q3_K_M.gguf	0.9458	220.24	3.56	16	discard	[latv2] EDG-415 r1a: control unlabelled dt0 infra->affected recovery OFF @16 audit | discarded: F1 below historical best (0.9458 vs 1.0000, epsilon=0.0001)
20260510T120101Z	5f617a68b0a1b433095b7422d5be2fc889ae4ad12a9d309dbb35b8e55181944b	Edge-Triage-gemma-4-E4B-it-Q3_K_M.gguf	0.9458	229.03	3.56	16	discard	[latv2] EDG-415 r1b: treatment unlabelled dt0 infra->affected recovery ON @16 audit | discarded: F1 below historical best (0.9458 vs 1.0000, epsilon=0.0001)
20260510T140130Z	5f617a68b0a1b433095b7422d5be2fc889ae4ad12a9d309dbb35b8e55181944b	Edge-Triage-gemma-4-E4B-it-Q3_K_M.gguf	0.9458	222.61	3.56	16	discard	[latv2] EDG-416 r1: unlabelled dt0 infra->affected trace audit @16 | discarded: F1 below historical best (0.9458 vs 1.0000, epsilon=0.0001)
20260510T160129Z	a24b6a531ea40868ab90da66933d39100403de51871b8fecf427a96c926c2a97	Edge-Triage-gemma-4-E4B-it-Q3_K_M.gguf	0.9081	252.03	3.57	16	discard	[latv2] EDG-418 r1: unlabelled dt0 rescue strict-probe trace audit @16 | discarded: F1 below historical best (0.9081 vs 1.0000, epsilon=0.0001)
20260510T180140Z	9f716b07055588afc7de491d5cf49a98f63d84eff1a53038edb953e185bcc47a	Edge-Triage-gemma-4-E4B-it-Q3_K_M.gguf	0.9081	249.30	3.57	16	discard	[latv2] EDG-420 r1: unlabelled dt0 rescue infra-fallback gate audit @16 | discarded: F1 below historical best (0.9081 vs 1.0000, epsilon=0.0001)
20260510T220143Z	5ad913bcd73047d8da8efc2a62e4d55d533e909ff648dec458f3f5378aa53d7e	Edge-Triage-gemma-4-E4B-it-Q3_K_M.gguf	0.9458	402.29	3.57	16	discard	[latv2] EDG-424 r1b: unlabelled dt0 rescue fallback policy infra_only @16 | discarded: F1 below historical best (0.9458 vs 1.0000, epsilon=0.0001)
20260510T220143Z	1bf65cc9e7c73f0621ba415859ad9e644133c0115ce2388300f3162f3c050324	Edge-Triage-gemma-4-E4B-it-Q3_K_M.gguf	0.9081	402.86	3.57	16	discard	[latv2] EDG-424 r1a: unlabelled dt0 rescue fallback policy baseline @16 | discarded: F1 below historical best (0.9081 vs 1.0000, epsilon=0.0001)
20260511T100240Z	0a9ab0f4e1720d8062daa364cd90ca42aabf3c1ef8c703081b7433347504363f	Edge-Triage-gemma-4-E4B-it-Q3_K_M.gguf	1.0000	279.29	3.58	16	keep	[latv2] Benchmark completed and metrics persisted.
