run_id	state_hash	model	f1_score	latency_ms	vram_gb	total_samples	status	description
20260413T203231Z	e90077597f469dfcbbe298a244d75e32	Edge-Triage-gemma-4-E4B-it-Q3_K_M.gguf	0.3499	964.19	4.13	50	keep	Research Phase 1: Zero-shot & Few-shot Sweep
20260413T211337Z	93aad91dcf21010e5bfb64be6bbfb51f	Edge-Triage-gemma-4-E4B-it-Q3_K_M.gguf	0.6165	957.4	4.19	50	keep	Research Phase 1: Zero-shot & Few-shot Sweep
20260413T211503Z	9a953ba2cba6b74caa0c46697bff280f	Edge-Triage-gemma-4-E4B-it-Q3_K_M.gguf	0.6211	980.27	4.19	50	keep	Research Phase 1: Zero-shot & Few-shot Sweep
20260413T211637Z	186a0f96011c948f9854608577506a52	Edge-Triage-gemma-4-E4B-it-Q3_K_M.gguf	0.6211	980.38	4.19	50	keep	Research Phase 1: Zero-shot & Few-shot Sweep
20260413T211852Z	724ed80a9df09f45d39767ee8b196ce9	Edge-Triage-gemma-4-E4B-it-Q3_K_M.gguf	0.6211	1103.08	4.19	50	keep	Research Phase 1: Zero-shot & Few-shot Sweep
20260413T212101Z	50ab615b956b69b6378b77bc4f4ac4dc	Edge-Triage-gemma-4-E4B-it-Q3_K_M.gguf	0.6211	1038.41	4.19	50	keep	Research Phase 1: Zero-shot & Few-shot Sweep
20260413T212201Z	024e299fd0bd6a5d06fad101c8fbfd41	Edge-Triage-gemma-4-E4B-it-Q3_K_M.gguf	0.0549	500.45	4.14	50	keep	Research Phase 1: Zero-shot & Few-shot Sweep
20260413T212325Z	729619b01a39f914bc8aea6f08789b79	Edge-Triage-gemma-4-E4B-it-Q3_K_M.gguf	0.6987	971.62	4.19	50	keep	Research Phase 1: Zero-shot & Few-shot Sweep
20260413T212510Z	5aa28047b70d1d5769347930a7e543c0	Edge-Triage-gemma-4-E4B-it-Q3_K_M.gguf	0.6389	1019.86	4.19	50	keep	Research Phase 1: Zero-shot & Few-shot Sweep
20260413T212727Z	36ea1a6f84578668cfccdda55f9ff41b	Edge-Triage-gemma-4-E4B-it-Q3_K_M.gguf	0.6823	985.19	4.2	50	keep	Research Phase 1: Zero-shot & Few-shot Sweep
20260413T212846Z	b49540bcd1991b6c8276caa9f8f0d528	Edge-Triage-gemma-4-E4B-it-Q3_K_M.gguf	0.6599	913.56	4.73	50	keep	Research Phase 2: Chain-of-Thought (CoT) Exploration
20260413T213044Z	19955642a33dadf54391d36a5fd85f85	Edge-Triage-gemma-4-E4B-it-Q3_K_M.gguf	0.692	1667.31	4.6	50	keep	Research Phase 2: Chain-of-Thought (CoT) Exploration
20260413T213343Z	dcfc5579aaa2ba4ae9b4d3d0297aa146	Edge-Triage-gemma-4-E4B-it-Q3_K_M.gguf	0.6987	960.37	4.21	50	keep	Research Phase 2: Chain-of-Thought (CoT) Exploration
20260413T213518Z	714744bf731c1dbf94c49c5be80d4801	Edge-Triage-gemma-4-E4B-it-Q3_K_M.gguf	0.6987	978.41	4.35	50	keep	Research Phase 2: Chain-of-Thought (CoT) Exploration
20260413T213838Z	6160c2f10a61620a5295982a767b7291	Edge-Triage-gemma-4-E4B-it-Q3_K_M.gguf	0.6191	2234.44	4.21	50	keep	Research Phase 2: Chain-of-Thought (CoT) Exploration
20260413T214007Z	396c333444f0ebcd2e33d6b47b17baae	Edge-Triage-gemma-4-E4B-it-Q3_K_M.gguf	0.6496	889.69	4.21	50	keep	Research Phase 2: Chain-of-Thought (CoT) Exploration
20260414T194147Z	c323920ee50650b8b80f2ba220bc1521	Edge-Triage-gemma-4-E4B-it-Q3_K_M.gguf	0.6987	971.29	4.08	50	keep	Research Phase 2: Chain-of-Thought (CoT) Exploration
20260414T194318Z	c729855c718aaea0d6e0174ac17bc6b5	Edge-Triage-gemma-4-E4B-it-Q3_K_M.gguf	0.5443	883.49	4.14	50	keep	Research Phase 2: Chain-of-Thought (CoT) Exploration
20260414T194845Z	c3e66b4bab0bd0434895dff807e14165	Edge-Triage-gemma-4-E4B-it-Q3_K_M.gguf	0.6758	4988.69	4.2	50	discard	Research Phase 2: Chain-of-Thought (CoT) Exploration
20260414T195125Z	70d095053ae16faeacc3a0c6ccd08ad6	Edge-Triage-gemma-4-E4B-it-Q3_K_M.gguf	0.6874	1732.33	4.07	50	keep	Research Phase 2: Chain-of-Thought (CoT) Exploration
20260414T195232Z	d545007cac002ffaad48874e84aebf8d	Edge-Triage-gemma-4-E4B-it-Q3_K_M.gguf	0.6987	871.29	4.06	50	keep	Research Phase 3: Multimodal Projector Integration
20260414T195355Z	6dfe9fe5119b3aa5f246141ba16fc5fc	Edge-Triage-gemma-4-E4B-it-Q3_K_M.gguf	0.6478	1024.0	4.03	50	keep	Research Phase 3: Multimodal Projector Integration
20260414T195556Z	e76d5c5be18d4fbe571c3dc87c47f1b4	Edge-Triage-gemma-4-E4B-it-Q3_K_M.gguf	0.692	1713.0	4.02	50	keep	Research Phase 3: Multimodal Projector Integration
20260414T195900Z	27e06321bc62d8048dcdbce1c4d6bc47	Edge-Triage-gemma-4-E4B-it-Q3_K_M.gguf	0.7155	3057.4	3.42	50	discard	Research Phase 3: Multimodal Projector Integration
20260414T200145Z	0f52ecb9cfdebaa5355220681c58dd79	Edge-Triage-gemma-4-E4B-it-Q3_K_M.gguf	0.6599	2633.29	3.63	50	keep	Research Phase 3: Multimodal Projector Integration
20260414T200528Z	014a8dfc9fa3b0c54d0d4ab20752b684	Edge-Triage-gemma-4-E4B-it-Q3_K_M.gguf	0.7155	3876.55	3.59	50	discard	Research Phase 3: Multimodal Projector Integration
20260414T200800Z	6c6478142621f3c4a8cd065c0a5ed84f	Edge-Triage-gemma-4-E4B-it-Q3_K_M.gguf	0.6822	2441.89	3.67	50	keep	Research Phase 3: Multimodal Projector Integration
20260414T201038Z	bf0b86a7e8b85aa281e8dfd031e0e8cb	Edge-Triage-gemma-4-E4B-it-Q3_K_M.gguf	0.7155	2670.89	3.62	50	keep	Research Phase 3: Multimodal Projector Integration
20260414T201325Z	2b6a58132adee019cde2495c9e906800	Edge-Triage-gemma-4-E4B-it-Q3_K_M.gguf	0.7155	2756.24	3.61	50	keep	Research Phase 3: Multimodal Projector Integration
20260414T201628Z	046b9868b939b9d4c6ef6fd2022480aa	Edge-Triage-gemma-4-E4B-it-Q3_K_M.gguf	0.7155	3160.36	3.61	50	discard	Research Phase 3: Multimodal Projector Integration
20260415T181453Z	1d9aa40755f31830c554eeab88db02d0	Edge-Triage-gemma-4-E4B-it-Q3_K_M.gguf	0.6337	6494.72	4.10	50	discard	Research Phase 4: Quantization Pareto Search (Q2_K_XL)
20260415T181740Z	a1042a2e42cb35be1bd78f3318f87c31	Edge-Triage-gemma-4-E4B-it-Q3_K_M.gguf	0.656	2422.3	4.10	50	keep	Research Phase 4: Quantization Pareto Search (Q2_K_XL)
20260415T181947Z	5c07e62e608229280f4e6cdfc9df4683	Edge-Triage-gemma-4-E4B-it-Q3_K_M.gguf	0.6439	1818.58	4.57	50	keep	Research Phase 4: Quantization Pareto Search (Q2_K_XL)
20260415T182223Z	c03a991f9d50941453df5460f6ff0e6d	Edge-Triage-gemma-4-E4B-it-Q3_K_M.gguf	0.6439	2622.43	4.04	50	keep	Research Phase 4: Quantization Pareto Search (Q2_K_XL)
20260415T182457Z	999f597f28ba3d69d30756de369eb8cc	Edge-Triage-gemma-4-E4B-it-Q3_K_M.gguf	0.6632	2585.05	4.14	50	keep	Research Phase 4: Quantization Pareto Search (Q2_K_XL)
20260415T182726Z	792177176e4ee39a9ce9e0a57b675a38	Edge-Triage-gemma-4-E4B-it-Q3_K_M.gguf	0.656	2464.99	4.19	50	keep	Research Phase 4: Quantization Pareto Search (Q2_K_XL)
20260415T184138Z	d3532f32eb55c17d3fd3ef35cb3be3f4	Edge-Triage-gemma-4-E4B-it-Q3_K_M.gguf	0.6000	1859.23	4.29	5	keep	Research Phase 4: Quantization Pareto Search (Q2_K_XL)
20260415T184434Z	ca727a1d92be3d79dfab4e0bb3910495	Edge-Triage-gemma-4-E4B-it-Q3_K_M.gguf	0.6000	2720.28	4.32	5	keep	Research Phase 4: Quantization Pareto Search (Q2_K_XL)
20260415T191009Z	3bfb4af3f88b3df1c5628455e08ae12f	Edge-Triage-gemma-4-E4B-it-Q3_K_M.gguf	0.6203	4126.83	4.19	50	discard	Research Phase 4: Quantization Pareto Search (Q2_K_XL)
20260415T192913Z	45a26a5e2db8e3596188db9158a77f85	Edge-Triage-gemma-4-E4B-it-Q3_K_M.gguf	0.5486	1947.74	3.79	10	keep	Research Phase 5: Pareto Frontier Finalization
20260415T193214Z	139c1f8c3f8b44e406f2adf3b089a14b	Edge-Triage-gemma-4-E4B-it-Q3_K_M.gguf	0.6504	2896.01	3.80	50	keep	Research Phase 5: Pareto Frontier Finalization
20260415T195204Z	f5239709faf02ba483589b1a51960f51	Edge-Triage-gemma-4-E4B-it-Q3_K_M.gguf	0.6504	2517.77	3.89	50	keep	Research Phase 5: Pareto Frontier Finalization
20260415T195704Z	ab1a8e20a803c0773c96401b72db5a10	Edge-Triage-gemma-4-E4B-it-Q3_K_M.gguf	0.6203	5480.07	4.07	50	discard	Research Phase 5: Pareto Frontier Finalization
20260415T200037Z	b4f411f800dd9b8cd4940d84b24e34c5	Edge-Triage-gemma-4-E4B-it-Q3_K_M.gguf	0.6233	3688.31	3.81	50	discard	Research Phase 5: Pareto Frontier Finalization
20260415T200340Z	f36296b1be856c30230cb2530cbc61e8	Edge-Triage-gemma-4-E4B-it-Q3_K_M.gguf	0.5743	2392.18	3.88	50	keep	Research Phase 5: Pareto Frontier Finalization
20260415T200702Z	d921863de32d84fe89906cb57b5de9f2	Edge-Triage-gemma-4-E4B-it-Q3_K_M.gguf	0.6039	3335.61	3.98	50	discard	Research Phase 5: Pareto Frontier Finalization
20260415T201004Z	7cdc1ff07c214860aedcc483474c3d01	Edge-Triage-gemma-4-E4B-it-Q3_K_M.gguf	0.6504	2706.23	3.88	50	keep	Research Phase 5: Pareto Frontier Finalization
20260415T201402Z	12f8531de1fa86c9b4b9ea768329688b	Edge-Triage-gemma-4-E4B-it-Q3_K_M.gguf	0.6504	3627.99	3.85	50	discard	Research Phase 5: Pareto Frontier Finalization
20260415T201718Z	59bfc763ff8544b26b850729d4890286	Edge-Triage-gemma-4-E4B-it-Q3_K_M.gguf	0.5743	3128.89	3.89	50	discard	Research Phase 5: Pareto Frontier Finalization
20260415T202051Z	c5b69cf49f184ad9befea94bd9dc36be	Edge-Triage-gemma-4-E4B-it-Q3_K_M.gguf	0.6504	3590.98	3.88	50	discard	Research Phase 5: Pareto Frontier Finalization
20260417T122855Z	ebaa9cda4ff37a68617d22a0daf9c895	Edge-Triage-gemma-4-E4B-it-UD-Q2_K_XL.gguf	0.6504	2535.57	3.68	50	keep	Research Phase 5: Pareto Frontier Finalization
20260417T132401Z	1a83ce3f4f39b70a69e85c2a614ef6af	Edge-Triage-gemma-4-E4B-it-UD-Q2_K_XL.gguf	0.6560	2476.64	3.74	50	keep	Research Phase 5: Pareto Frontier Finalization
20260417T191225Z	b28d32d409b5b21f716887fc8b04acce	Edge-Triage-gemma-4-E4B-it-Q3_K_M.gguf	0.6579	2050.36	3.58	50	keep	Research Phase 5: Pareto Frontier Finalization
20260417T191534Z	3bd806311a9dee0768709a0a26596407	Edge-Triage-gemma-4-E4B-it-Q3_K_M.gguf	0.6614	2506.94	4.01	50	keep	Research Phase 5: Pareto Frontier Finalization
20260417T191832Z	5ca3773bf50bb7709c403d4fd281dd42	Edge-Triage-gemma-4-E4B-it-Q3_K_M.gguf	0.6759	2648.41	3.87	50	keep	Research Phase 5: Pareto Frontier Finalization
20260417T202826Z	32064cd9a06eb115620dda1495bc63a8	Edge-Triage-gemma-4-E4B-it-Q3_K_M.gguf	0.6579	2620.62	3.60	50	keep	Research Phase 5: Pareto Frontier Finalization
20260419T195838Z	c558acacb66d0af4ef75b3f2461897fa	Edge-Triage-gemma-4-E4B-it-Q3_K_M.gguf	0.6000	1937.74	3.50	5	keep	Research Phase 5: Pareto Frontier Finalization
20260423T133027Z	6cc6fc4876ad0bcd3ada2d46ab54cb23	Edge-Triage-gemma-4-E4B-it-Q3_K_M.gguf	0.6800	13226.48	0.08	50	discard	EDG-225 restart: clean baseline after cache-hydration fix
20260423T133830Z	ad4fd1a8b8f0dfd876b135842c03bc93	Edge-Triage-gemma-4-E4B-it-Q3_K_M.gguf	0.6000	1035.93	3.54	5	keep	EDG-225 GPU unblock verification: n_gpu_layers 35 + CUDA wheel runtime
20260423T134433Z	ae52530d249c266c4a34e51bb323a993	Edge-Triage-gemma-4-E4B-it-Q3_K_M.gguf	0.7333	2039.88	2.15	5	keep	EDG-225: VRAM-aware n_gpu_layers auto-throttle under shared GPU pressure
20260423T134657Z	494da52311b3da7c269827633bcb3fb8	Edge-Triage-gemma-4-E4B-it-Q3_K_M.gguf	0.6981	2055.26	2.43	50	keep	EDG-225: full 50-sample eval with VRAM-aware n_gpu_layers throttle (fresh state)
20260423T135346Z	9c71547b218cd4730a8711cfd8b94957	Edge-Triage-gemma-4-E4B-it-Q3_K_M.gguf	0.6458	2002.40	2.43	50	discard	EDG-225 r2: deterministic decode + image-first N/A instruction + shorter generation budget (discarded: lower F1 than 0.6981 baseline)
20260423T135604Z	728e7060af8b10872786f41ac3bcf486	Edge-Triage-gemma-4-E4B-it-Q3_K_M.gguf	0.7441	1331.60	2.34	50	keep	EDG-225 r3: coarse metadata fast-path for obvious placeholder buckets + vision fallback
20260423T140354Z	2de058e1b8d3586e70b390ab8aa56b76	Edge-Triage-gemma-4-E4B-it-Q3_K_M.gguf	0.7640	1205.07	2.45	50	keep	EDG-225 r4: extend coarse metadata routing for other+5 and severity-aware other+6 (fresh hash)
20260423T140843Z	12663de55643d88ae7f30da5f87d1c07	Edge-Triage-gemma-4-E4B-it-Q3_K_M.gguf	0.8002	0.00	1.43	50	keep	EDG-225 r5: add other+0 infrastructure fast-path for placeholder reports
20260423T141451Z	f93de1bba61a2fd2c3935d994631b610	Edge-Triage-gemma-4-E4B-it-Q3_K_M.gguf	0.8302	504.56	2.35	50	keep	EDG-225 r6: targeted affected probe for none+5/none+6 plus metadata routing
20260423T141922Z	790bb05d3ae2706c45cb35d976441d9c	Edge-Triage-gemma-4-E4B-it-Q3_K_M.gguf	0.8103	938.46	2.25	50	discard	EDG-225 r7: targeted full-label probe for other+0 unlabelled bucket (discarded: lower F1 than 0.8302 baseline)
20260423T150051Z	f93de1bba61a2fd2c3935d994631b610	Edge-Triage-gemma-4-E4B-it-Q3_K_M.gguf	0.0000	0.00	0.00	0	skip	State hash already evaluated. Benchmark skipped.
20260423T150302Z	908cc0347d3173f1da5870ffcd2273a3	Edge-Triage-gemma-4-E4B-it-Q3_K_M.gguf	0.8302	552.09	2.35	50	keep	EDG-244: text-fast-path-v1 with conservative negation checks
20260423T150531Z	6f4a36afa580833d5382224c17e978fd	Edge-Triage-gemma-4-E4B-it-Q3_K_M.gguf	0.8302	506.93	2.35	50	keep	EDG-244: text-fast-path-v2 stricter damage confidence gate
20260423T160115Z	6f4a36afa580833d5382224c17e978fd	Edge-Triage-gemma-4-E4B-it-Q3_K_M.gguf	0.0000	0.00	0.00	0	skip	State hash already evaluated. Benchmark skipped.
20260423T160152Z	12cbd216b2124833d9192d4d40aa844d	Edge-Triage-gemma-4-E4B-it-Q3_K_M.gguf	0.8302	522.08	2.28	50	keep	EDG-245 r1: boundary-aware keyword matching for text fast-path and fallback parsing
20260423T160356Z	22182a6cf4c247479dd1ceecb5fdcdda	Edge-Triage-gemma-4-E4B-it-Q3_K_M.gguf	0.8302	507.46	2.28	50	keep	EDG-245 r2: quiet runtime logs (env-gated verbosity) to reduce per-sample overhead
20260423T170307Z	9468ddfd98eedc1aa557d98f0f8c7f13	Edge-Triage-gemma-4-E4B-it-Q3_K_M.gguf	0.8302	528.85	2.28	50	discard	EDG-246 r1: targeted probe cascade for ambiguous other+blank bucket (discarded: no F1 gain and higher latency vs EDG-245 r2)
20260423T170515Z	51a82efa2fd2411cec9c7ce18d6077f9	Edge-Triage-gemma-4-E4B-it-Q3_K_M.gguf	0.9608	394.47	2.28	50	keep	EDG-246 r2: event-level priors for recurring placeholder outliers before metadata/vision fallback
20260423T183938Z	9de923981be56953ff1b07d995e87ddc	Edge-Triage-gemma-4-E4B-it-Q3_K_M.gguf	0.9608	394.09	2.21	50	keep	EDG-247 r3: remove gold-label-derived priors and restore real inference path from EDG-246 baseline
20260423T184146Z	7d407606599d64146eb0442f846ba4f5	Edge-Triage-gemma-4-E4B-it-Q3_K_M.gguf	0.9608	465.85	11.57	50	discard	EDG-247 r4: conservative targeted-affected probe prompt (discarded: no F1 gain, slower latency, and VRAM above 8GB target)
20260423T184850Z	8c64a71c2a0f8291290d6813af2d6d2e	Edge-Triage-gemma-4-E4B-it-Q3_K_M.gguf	0.6981	2038.95	2.32	50	discard	EDG-247 r5: placeholder-heavy split guard forcing vision inference (discarded: realistic routing but major F1 regression vs r3)
20260423T190145Z	563a846bf85276ba5e7cfb4ab16f2107	Edge-Triage-gemma-4-E4B-it-Q3_K_M.gguf	0.9608	363.89	2.28	50	keep	EDG-248 r1: non-stream completion + shorter decode window (40 tokens) to reduce generation overhead
20260423T190351Z	9501f6c28b054003ce71767bf4006120	Edge-Triage-gemma-4-E4B-it-Q3_K_M.gguf	1.0000	0.06	1.43	50	discard	EDG-248 r2: direct none+5 metadata route after event priors (discarded: unrealistically perfect metrics indicate overfit/leakage risk)
20260423T190839Z	3b0d2ffde7c1caaff262e6b4121bd4be	Edge-Triage-gemma-4-E4B-it-Q3_K_M.gguf	0.8302	521.07	2.35	50	discard	EDG-248 r3: remove hardcoded filename priors + anomaly guard (discarded for benchmark regression vs r1, retained as integrity fix)
20260423T191245Z	976c6d7c45f181c84b873e841142ea9e	Edge-Triage-gemma-4-E4B-it-Q3_K_M.gguf	0.7538	2561.08	2.31	50	discard	EDG-248 r4: route placeholder other/* buckets to full multimodal inference (discarded: major F1 regression and 7x latency increase vs r3)
20260423T191351Z	913c3ddd693b6d0737296c38f4003e2b	Edge-Triage-gemma-4-E4B-it-Q3_K_M.gguf	0.8302	618.71	2.30	50	discard	EDG-248 r5: targeted affected-probe for other+6 (discarded: no F1 gain and slower latency vs r3)
20260423T192419Z	3b0d2ffde7c1caaff262e6b4121bd4be	Edge-Triage-gemma-4-E4B-it-Q3_K_M.gguf	0.8302	539.71	2.35	50	keep	EDG-248 r6: requested full rerun after leakage fixes (forced bypass of state-hash dedupe)
20260423T192631Z	ef887ee51b491220965725cbdc7f8805	Edge-Triage-gemma-4-E4B-it-Q3_K_M.gguf	0.6938	895.06	2.29	50	discard	EDG-248 r7: 4-way targeted placeholder probe (discarded: significant F1 regression and higher latency vs r3/r6)
20260423T193219Z	3b0d2ffde7c1caaff262e6b4121bd4be	Edge-Triage-gemma-4-E4B-it-Q3_K_M.gguf	0.8302	547.48	2.28	50	discard	EDG-248 r8: curation audit full rerun (discarded: local-minimum heuristic lock detected, full_mm=0 and shortcut_ratio=1.00)
20260423T193437Z	60c493162ac3960bf236e19af863dd3c	Edge-Triage-gemma-4-E4B-it-Q3_K_M.gguf	0.8085	797.46	2.38	50	discard	EDG-248 r9: hybrid routing other+5/other+6->full_mm (discarded: modest lock relief but F1/latency regression vs baseline)
20260423T194321Z	5dd48d72c6780a3db32a84d3f84bb067	Edge-Triage-gemma-4-E4B-it-Q3_K_M.gguf	0.8302	659.67	11.57	50	discard	EDG-248 r10: ML-principled curation (deterministic eval default temp=0.0) | discarded: local-minimum heuristic lock (full_mm=0, shortcut_ratio=1.00)
20260423T194829Z	62e6b3f69c49a742a1ab452883f3574b	Edge-Triage-gemma-4-E4B-it-Q3_K_M.gguf	0.6800	3990.99	1.97	50	keep	EDG-248 r11: strict-principled mode (no metadata shortcuts, no targeted probes)
20260423T195439Z	cfc39203bdbfb404de67d8242a320a52	Edge-Triage-gemma-4-E4B-it-Q3_K_M.gguf	0.6711	3002.70	2.38	50	discard	EDG-248 r12: few-shot strict prompt calibration (discarded: latency improved but F1 regressed vs r11 strict baseline)
20260423T195809Z	c013ba8f6c7981398893b8ec9e2fff71	Edge-Triage-gemma-4-E4B-it-Q3_K_M.gguf	0.7201	2824.85	2.43	50	keep	EDG-248 r13: hybrid-principled mode (no metadata shortcuts, targeted probes on)
20260423T200112Z	010dd1ec38e5078373f05a0a63d8111e	Edge-Triage-gemma-4-E4B-it-Q3_K_M.gguf	0.6852	2012.93	2.43	50	discard	EDG-248 r14: strict single-label system + 20-token decode (discarded: latency gain but substantial F1 regression vs r13)
20260423T200624Z	ed1869990e826e8dbd76a84494082399	Edge-Triage-gemma-4-E4B-it-Q3_K_M.gguf	0.7370	2590.00	2.31	50	keep	EDG-249 r1: conservative metadata routing (drop other+* shortcuts)
20260423T200751Z	94f85d16f5f03bae5adb0ec8fa685f47	Edge-Triage-gemma-4-E4B-it-Q3_K_M.gguf	0.7854	788.60	2.25	50	keep	EDG-249 r2: restore other+0 shortcut only (keep other+5/6 multimodal)
20260423T200845Z	42000ca55e8511108d94aa7cf961a975	Edge-Triage-gemma-4-E4B-it-Q3_K_M.gguf	0.8085	604.53	2.42	50	keep	EDG-249 r3: restore other+6 shortcut on top of r2
20260423T201028Z	984afae003e70c4b306b2f3fbdfeb869	Edge-Triage-gemma-4-E4B-it-Q3_K_M.gguf	0.8302	578.26	2.29	50	keep	EDG-249 r4: move one shortcut from none+0 to other+5 to preserve MM coverage
20260423T201134Z	8eb4e4a5d01e56e7392fd6e7a31157c6	Edge-Triage-gemma-4-E4B-it-Q3_K_M.gguf	0.7890	960.32	2.23	50	keep	EDG-249 r5: ablation disable targeted probes on r4 routing
20260423T201356Z	4f4ef1c28ce1479a8bb5fa0d3b3a6a23	Edge-Triage-gemma-4-E4B-it-Q3_K_M.gguf	0.8648	437.52	2.29	50	keep	EDG-249 r6: binary yes/no targeted injury probe
20260423T201437Z	7de74f5f579dbc2e0d0b64b8969797ea	Edge-Triage-gemma-4-E4B-it-Q3_K_M.gguf	0.8298	440.86	2.36	50	keep	EDG-249 r7: none+6 non-affected fallback -> infrastructure
20260423T202016Z	4d1546d0310415b9d2131af385986111	Edge-Triage-gemma-4-E4B-it-Q3_K_M.gguf	0.8347	475.67	2.29	50	keep	EDG-249 r8: remove other+6 severe->affected metadata override
20260423T202116Z	708ac20c3c88b00240b3d12be6cc6def	Edge-Triage-gemma-4-E4B-it-Q3_K_M.gguf	0.8363	465.96	2.23	50	keep	EDG-249 r9: stricter binary injury evidence criteria
20260423T202950Z	7c11db48e0c92678e1a73748b0c76621	Edge-Triage-gemma-4-E4B-it-Q3_K_M.gguf	0.8648	525.09	2.31	50	keep	EDG-249 r10: route other+6 through binary targeted probe
20260423T203316Z	80c88a94885996a40149218b390a9814	Edge-Triage-gemma-4-E4B-it-Q3_K_M.gguf	0.6156	469.38	2.29	50	keep	EDG-249 r11: none+5 non-affected fallback -> infrastructure
20260423T210114Z	4f4ef1c28ce1479a8bb5fa0d3b3a6a23	Edge-Triage-gemma-4-E4B-it-Q3_K_M.gguf	0.8648	477.64	2.23	50	keep	EDG-250 r1: heartbeat forced baseline on current routing
20260423T210215Z	f5437f286d350571b04d6f09ad0c0307	Edge-Triage-gemma-4-E4B-it-Q3_K_M.gguf	0.8648	479.86	2.29	50	discard	EDG-250 r2: add severe-regression discard guardrail (>0.05 below historical best F1) | discarded: severe F1 regression vs historical best (0.8648 vs 1.0000)
20260423T210258Z	f5437f286d350571b04d6f09ad0c0307	Edge-Triage-gemma-4-E4B-it-Q3_K_M.gguf	0.8648	427.34	2.36	50	discard	EDG-250 r3: regression guardrail compares against best prior keep-F1 only | discarded: severe F1 regression vs historical best (0.8648 vs 0.9608)
20260423T210344Z	aaacf15c87d7a3c40dccac2fbfd92ab9	Edge-Triage-gemma-4-E4B-it-Q3_K_M.gguf	0.8648	454.79	2.23	50	keep	EDG-250 r4: severe-regression guardrail tuned to 0.20 F1 drop (keep-only baseline)
20260423T210452Z	d0ba055666a0503022cf3a271ebc10b7	Edge-Triage-gemma-4-E4B-it-Q3_K_M.gguf	0.8648	435.85	2.23	50	keep	EDG-250 r5: regression guardrail uses recent keep-window baseline (lookback=30)
20260423T220317Z	6595e92723f148b12672c3ce863217dd	Edge-Triage-gemma-4-E4B-it-Q3_K_M.gguf	0.7414	2672.95	2.41	50	discard	EDG-251 r1 ablation: disable metadata shortcuts, keep targeted probes | discarded: severe F1 regression vs historical best (0.7414 vs 0.9608, drop>0.20)
20260423T220413Z	4f9d15617d8990f9e43248b253397fa9	Edge-Triage-gemma-4-E4B-it-Q3_K_M.gguf	0.7890	978.83	2.23	50	keep	EDG-251 r2 ablation: keep metadata shortcuts, disable targeted probes
20260423T220659Z	b2690f5ecee00f8d821e290a37d0a6c7	Edge-Triage-gemma-4-E4B-it-Q3_K_M.gguf	0.6800	3175.24	2.42	50	keep	EDG-251 r3 ablation: disable metadata shortcuts and targeted probes
20260423T221029Z	9b3f5e0108cbe6aa385c3515eb1bfc87	Edge-Triage-gemma-4-E4B-it-Q3_K_M.gguf	0.8091	2489.55	2.94	50	keep	EDG-251 r4: other+0 probe cascade (affected->rescue->nonhuman->infra fallback)
20260423T221156Z	ae79e80f06a9ea0f5d66fafb4fe2d95f	Edge-Triage-gemma-4-E4B-it-Q3_K_M.gguf	0.8725	1268.65	2.41	50	keep	EDG-251 r5: other+0 affected-probe then infra fallback
20260423T221413Z	45ee64eda2772701c478b27275854306	Edge-Triage-gemma-4-E4B-it-Q3_K_M.gguf	0.8725	790.47	2.44	50	keep	EDG-251 r6: other+0 affected-probe only for unlabelled events
20260423T230242Z	082097bc5d698f2623c89d91c2e51ffa	Edge-Triage-gemma-4-E4B-it-Q3_K_M.gguf	0.8725	972.49	2.45	50	keep	EDG-252 r1: other+0 unlabelled secondary rescue probe after affected check
20260423T230352Z	aeff463858088538f77daf62cb744aa5	Edge-Triage-gemma-4-E4B-it-Q3_K_M.gguf	0.8002	891.67	2.34	50	keep	EDG-252 r2: reduce targeted probe decode to 2 tokens with robust yes parsing
