run_id	state_hash	model	f1_score	latency_ms	vram_gb	total_samples	status	description
20260430T120159Z	3b67876dac40f66d982b67d52a88a7cee1693aea68b60b96f30d36eb84320eaf	Edge-Triage-gemma-4-E4B-it-Q3_K_M.gguf	0.9794	163.86	3.92	50	keep	[latv2] EDG-327 r4 promote: set default n_ctx=934 + signature refresh
20260430T120229Z	79b3a1f5fceab44961bf26c96e784a4483413fbdf1e9eb176a179547d0925d29	Edge-Triage-gemma-4-E4B-it-Q3_K_M.gguf	0.9600	166.86	3.95	50	discard	[latv2] EDG-327 r5 sweep: n_batch=208 on n_ctx=934 gpu46 baseline | discarded: F1 below historical best (0.9600 vs 0.9794, epsilon=0.0001)
20260430T120245Z	6c3884e210ed37b7cfd2bf61106f7b91bcc2e4dd01a6aa6752fa9b94f93794e6	Edge-Triage-gemma-4-E4B-it-Q3_K_M.gguf	0.9794	171.93	3.92	50	discard	[latv2] EDG-327 r6 sweep: n_batch=176 on n_ctx=934 gpu46 baseline | discarded: same-F1 band but slower latency (171.93 ms vs best 163.41 ms, epsilon=3.00 ms)
20260430T120303Z	a364f6b93174fb8d7e20de7af9c9e93577142acd2883c10392b835a72e1449e2	Edge-Triage-gemma-4-E4B-it-Q3_K_M.gguf	0.9794	170.93	3.93	50	discard	[latv2] EDG-327 r7 sweep: n_gpu_layers=47 on n_ctx=934 n_batch=192 baseline | discarded: same-F1 band but slower latency (170.93 ms vs best 163.41 ms, epsilon=3.00 ms)
20260430T140109Z	97c45354fb66a761e427bc98a1d77137dde3b23e84f4ab77a1980316afe252a6	Edge-Triage-gemma-4-E4B-it-Q3_K_M.gguf	0.9612	171.36	3.93	50	discard	[latv2] EDG-328 r1 sweep: n_ctx=936 on gpu46 n_batch=192 baseline | discarded: F1 below historical best (0.9612 vs 0.9794, epsilon=0.0001)
20260430T140148Z	fc6ccb5489b7308485efa6f95dfc25891849af11510eafb884e2dd3b6c167edd	Edge-Triage-gemma-4-E4B-it-Q3_K_M.gguf	0.9794	169.44	3.98	50	discard	[latv2] EDG-328 r2 sweep: n_batch=224 on n_ctx=934 gpu46 baseline | discarded: same-F1 band but slower latency (169.44 ms vs best 163.41 ms, epsilon=3.00 ms)
20260430T140230Z	932bad0866713d8bd62e4169efd8f9c889792a6dbad9a854e86cae16fe59fb7f	Edge-Triage-gemma-4-E4B-it-Q3_K_M.gguf	0.9415	176.17	3.93	50	discard	[latv2] EDG-328 r3 sweep: n_batch=184 on n_ctx=934 gpu46 baseline | discarded: F1 below historical best (0.9415 vs 0.9794, epsilon=0.0001)
20260430T140254Z	609ac93f1f33b1083e4422a51f48c9dcab4a0a5f5062e04dc4e4b0c56898532d	Edge-Triage-gemma-4-E4B-it-Q3_K_M.gguf	0.9600	167.22	3.95	50	discard	[latv2] EDG-328 r4 sweep: n_batch=200 on n_ctx=934 gpu46 baseline | discarded: F1 below historical best (0.9600 vs 0.9794, epsilon=0.0001)
20260430T140321Z	04dc08b98b1d59c1de04053da6588c95cb3f287df67a7e3ef543813f6e028802	Edge-Triage-gemma-4-E4B-it-Q3_K_M.gguf	0.9794	165.52	3.93	50	keep	[latv2] EDG-328 r5: relax shortcut guard max ratio to 0.92
20260430T140347Z	00193c95d203981a56cda8a8b609637c299c74c97aab1084b53d36e1b03467cf	Edge-Triage-gemma-4-E4B-it-Q3_K_M.gguf	0.9794	169.41	3.92	50	discard	[latv2] EDG-328 r6: relax shortcut guard max ratio to 0.94 | discarded: same-F1 band but slower latency (169.41 ms vs best 163.41 ms, epsilon=3.00 ms)
20260430T160059Z	cab906b2522660d3a3a9e22ed7f3bda8b1aefd318ffa8961d0afd8bd1d21ad0b	Edge-Triage-gemma-4-E4B-it-Q3_K_M.gguf	0.9572	147.77	4.08	50	discard	[latv2] EDG-329 r1: cap targeted probes at 8 per bucket | discarded: F1 below historical best (0.9572 vs 0.9794, epsilon=0.0001)
20260430T160117Z	f8043ca19b390a7156881a0d82cb4ae82a94dc9d2aa17112fcd99dfcf9bf1331	Edge-Triage-gemma-4-E4B-it-Q3_K_M.gguf	0.9794	165.14	4.12	50	keep	[latv2] EDG-329 r2: cap targeted probes at 18 per bucket
20260430T160201Z	c5b20b74efad85edbe3c7f2693f2c0d02a38a3bea941e18c2db655a4b0f187ab	Edge-Triage-gemma-4-E4B-it-Q3_K_M.gguf	0.9794	168.32	4.11	50	discard	[latv2] EDG-329 sweep: cap targeted probes at 14 per bucket | discarded: same-F1 band but slower latency (168.32 ms vs best 163.41 ms, epsilon=3.00 ms)
20260430T160213Z	cd5c37c051bfb22e3355afea7f97f4c97b599529346fb0619d941d7410b5ad5f	Edge-Triage-gemma-4-E4B-it-Q3_K_M.gguf	0.9794	164.96	4.11	50	keep	[latv2] EDG-329 sweep: cap targeted probes at 15 per bucket
20260430T160224Z	c2f0623e2f7ce59af73bcdd044c6ed78a65d99f1086ee86063d9de124858a1ce	Edge-Triage-gemma-4-E4B-it-Q3_K_M.gguf	0.9794	164.67	4.12	50	keep	[latv2] EDG-329 sweep: cap targeted probes at 16 per bucket
20260430T160236Z	eeed0103c86769c3c7a924f8264a90beb98c61adaa94592491ac5200f75f6bbc	Edge-Triage-gemma-4-E4B-it-Q3_K_M.gguf	0.9794	165.37	4.12	50	keep	[latv2] EDG-329 sweep: cap targeted probes at 17 per bucket
20260430T160300Z	765160cd4af46afc22016506e428bcb1af2d8f8dcf4bc4e154d09beb3c352db8	Edge-Triage-gemma-4-E4B-it-Q3_K_M.gguf	0.9572	152.87	4.09	50	discard	[latv2] EDG-329 sweep2: cap targeted probes at 9 per bucket | discarded: F1 below historical best (0.9572 vs 0.9794, epsilon=0.0001)
20260430T160311Z	da68ca447981a6d149d9861f989652f84d05519436a6343a5cc1f2fd1a527611	Edge-Triage-gemma-4-E4B-it-Q3_K_M.gguf	0.9572	155.16	4.09	50	discard	[latv2] EDG-329 sweep2: cap targeted probes at 10 per bucket | discarded: F1 below historical best (0.9572 vs 0.9794, epsilon=0.0001)
20260430T160323Z	8b0d7765dc8de0b64928c7b7ab37ec3ad10816cfdc6f7eac9e9639d2d603ee93	Edge-Triage-gemma-4-E4B-it-Q3_K_M.gguf	0.9794	160.74	4.11	50	keep	[latv2] EDG-329 sweep2: cap targeted probes at 11 per bucket
20260430T160334Z	0beaa81e98242d17197f68945e7a4fd98d837b881bb56f94616488ab71ef532d	Edge-Triage-gemma-4-E4B-it-Q3_K_M.gguf	0.9794	166.41	4.12	50	discard	[latv2] EDG-329 sweep2: cap targeted probes at 12 per bucket | discarded: same-F1 band but slower latency (166.41 ms vs best 160.74 ms, epsilon=3.00 ms)
20260430T160346Z	cbf73744585973c3d60aebd8591e0afb3da18a21a5b17cda85b82818273de5ec	Edge-Triage-gemma-4-E4B-it-Q3_K_M.gguf	0.9794	164.74	4.12	50	discard	[latv2] EDG-329 sweep2: cap targeted probes at 13 per bucket | discarded: same-F1 band but slower latency (164.74 ms vs best 160.74 ms, epsilon=3.00 ms)
20260430T180101Z	2de7702422d3effe8fbe1a6c38a274b18b2cccae9da5d6a37df5360f335684b4	Edge-Triage-gemma-4-E4B-it-Q3_K_M.gguf	0.9794	170.91	10.16	50	discard	[latv2] EDG-330 r1 probe-budget11 hash-hardening cpu-guard-cap | discarded: same-F1 band but slower latency (170.91 ms vs best 160.74 ms, epsilon=3.00 ms)
20260430T180152Z	2de7702422d3effe8fbe1a6c38a274b18b2cccae9da5d6a37df5360f335684b4	Edge-Triage-gemma-4-E4B-it-Q3_K_M.gguf	0.0000	0.00	0.00	0	skip	State hash already evaluated. Benchmark skipped.
20260430T180154Z	2de7702422d3effe8fbe1a6c38a274b18b2cccae9da5d6a37df5360f335684b4	Edge-Triage-gemma-4-E4B-it-Q3_K_M.gguf	0.0000	0.00	0.00	0	skip	State hash already evaluated. Benchmark skipped.
20260430T180156Z	2de7702422d3effe8fbe1a6c38a274b18b2cccae9da5d6a37df5360f335684b4	Edge-Triage-gemma-4-E4B-it-Q3_K_M.gguf	0.0000	0.00	0.00	0	skip	State hash already evaluated. Benchmark skipped.
20260430T180218Z	2de7702422d3effe8fbe1a6c38a274b18b2cccae9da5d6a37df5360f335684b4	Edge-Triage-gemma-4-E4B-it-Q3_K_M.gguf	0.9794	162.02	10.16	50	keep	[latv2] EDG-330 r3 forced-repeat1 budget11 variance-check
20260430T180229Z	2de7702422d3effe8fbe1a6c38a274b18b2cccae9da5d6a37df5360f335684b4	Edge-Triage-gemma-4-E4B-it-Q3_K_M.gguf	0.9794	161.69	10.16	50	keep	[latv2] EDG-330 r3 forced-repeat2 budget11 variance-check
20260430T200206Z	2de7702422d3effe8fbe1a6c38a274b18b2cccae9da5d6a37df5360f335684b4	Edge-Triage-gemma-4-E4B-it-Q3_K_M.gguf	0.9794	169.04	3.84	50	discard	[latv2] EDG-331 r1: process-scoped VRAM accounting for shared GPU hosts | discarded: same-F1 band but slower latency (169.04 ms vs best 160.74 ms, epsilon=3.00 ms)
20260430T200302Z	2de7702422d3effe8fbe1a6c38a274b18b2cccae9da5d6a37df5360f335684b4	Edge-Triage-gemma-4-E4B-it-Q3_K_M.gguf	0.9794	163.29	3.84	50	keep	[latv2] EDG-331 r2 forced-repeat1 process-vram variance-check
20260430T200314Z	2de7702422d3effe8fbe1a6c38a274b18b2cccae9da5d6a37df5360f335684b4	Edge-Triage-gemma-4-E4B-it-Q3_K_M.gguf	0.9794	163.80	3.84	50	discard	[latv2] EDG-331 r3 forced-repeat2 process-vram variance-check | discarded: same-F1 band but slower latency (163.80 ms vs best 160.74 ms, epsilon=3.00 ms)
20260430T200357Z	02c2d8bdce58a7b451b1427dcde64738e3fd8cc19dd34b6f29fbf576114d9800	Edge-Triage-gemma-4-E4B-it-Q3_K_M.gguf	0.9794	163.15	3.84	50	keep	[latv2] EDG-331 r4 sweep: n_ctx=933 on process-vram baseline
20260430T220103Z	2de7702422d3effe8fbe1a6c38a274b18b2cccae9da5d6a37df5360f335684b4	Edge-Triage-gemma-4-E4B-it-Q3_K_M.gguf	0.9794	162.45	3.84	50	keep	[latv2] EDG-332 r1 forced-repeat baseline probe-budget11 n_ctx934
20260430T220117Z	02c2d8bdce58a7b451b1427dcde64738e3fd8cc19dd34b6f29fbf576114d9800	Edge-Triage-gemma-4-E4B-it-Q3_K_M.gguf	0.9794	161.92	3.84	50	keep	[latv2] EDG-332 r2 forced-repeat candidate probe-budget11 n_ctx933
20260430T220202Z	02c2d8bdce58a7b451b1427dcde64738e3fd8cc19dd34b6f29fbf576114d9800	Edge-Triage-gemma-4-E4B-it-Q3_K_M.gguf	0.9794	163.46	3.84	50	keep	[latv2] EDG-332 r3 forced-repeat variance n_ctx933
20260430T220214Z	02c2d8bdce58a7b451b1427dcde64738e3fd8cc19dd34b6f29fbf576114d9800	Edge-Triage-gemma-4-E4B-it-Q3_K_M.gguf	0.9794	161.50	3.85	50	keep	[latv2] EDG-332 r4 forced-repeat variance n_ctx933
20260430T220225Z	02c2d8bdce58a7b451b1427dcde64738e3fd8cc19dd34b6f29fbf576114d9800	Edge-Triage-gemma-4-E4B-it-Q3_K_M.gguf	0.9794	162.34	3.84	50	keep	[latv2] EDG-332 r5 forced-repeat variance n_ctx933
20260501T080125Z	d74b4150cc5f42c3396bfaeb4602fa0065e76ecf7e97b4d10ce16e92b49bf410	Edge-Triage-gemma-4-E4B-it-Q3_K_M.gguf	0.9794	164.74	3.84	50	discard	[latv2] EDG-333 r1: promote default n_ctx to 933 from EDG-332 repeat stability | discarded: same-F1 band but slower latency (164.74 ms vs best 160.74 ms, epsilon=3.00 ms)
20260501T100130Z	d74b4150cc5f42c3396bfaeb4602fa0065e76ecf7e97b4d10ce16e92b49bf410	Edge-Triage-gemma-4-E4B-it-Q3_K_M.gguf	0.9794	160.59	3.84	50	keep	[latv2] EDG-334 r1: validate hash-hardening + probe-budget11 + process-vram under promoted n_ctx=933
20260501T120053Z	a7c08373eb82b41de37d842716ec7dded8880696329d4234f858fa648b08df9c	Edge-Triage-gemma-4-E4B-it-Q3_K_M.gguf	0.9794	167.25	3.82	50	discard	[latv2] EDG-335 r1: n_batch=176 micro-sweep at n_ctx933 probe-budget11 | discarded: same-F1 band but slower latency (167.25 ms vs best 160.59 ms, epsilon=3.00 ms)
20260501T120109Z	7af32320c431f720dc22322dff3caf0d52233cad3da6e72b2449db810ce78731	Edge-Triage-gemma-4-E4B-it-Q3_K_M.gguf	0.9415	167.74	3.83	50	discard	[latv2] EDG-335 r2: n_batch=184 micro-sweep at n_ctx933 probe-budget11 | discarded: F1 below historical best (0.9415 vs 0.9794, epsilon=0.0001)
20260501T120125Z	d74b4150cc5f42c3396bfaeb4602fa0065e76ecf7e97b4d10ce16e92b49bf410	Edge-Triage-gemma-4-E4B-it-Q3_K_M.gguf	0.9794	161.12	3.84	50	keep	[latv2] EDG-335 r3: n_batch=192 control rerun at n_ctx933 probe-budget11
20260501T120240Z	3d273812c2f53aa9ef80ff897d333fa262a656989d63f1b4e5a0cd0979d74d29	Edge-Triage-gemma-4-E4B-it-Q3_K_M.gguf	0.9794	161.73	3.84	50	keep	[latv2] EDG-335 r4: n_gpu_layers=45 micro-sweep with n_batch192 n_ctx933
20260501T120255Z	1d658c3cd576ddb476e58d7afa92e52480eaa3eac66dc2e353df8d147939f252	Edge-Triage-gemma-4-E4B-it-Q3_K_M.gguf	0.9794	159.78	3.84	50	keep	[latv2] EDG-335 r5: n_gpu_layers=47 micro-sweep with n_batch192 n_ctx933
20260501T120334Z	e7ec3c25ee798e8fb20d93df5dd6edb2d8fdde3ab8d5e7de640a59d7625b33e1	Edge-Triage-gemma-4-E4B-it-Q3_K_M.gguf	0.9794	159.94	3.84	50	keep	[latv2] EDG-335 r6: post-promotion verification for gpu47 default
20260501T140100Z	6308965d87371ae968e4880ec34bb282518ba779a57a9d9c86df46ffefc530e2	Edge-Triage-gemma-4-E4B-it-Q3_K_M.gguf	0.9794	163.04	3.84	50	discard	[latv2] EDG-336 r1: n_ctx=932 micro-sweep on gpu47/batch192/probebudget11 | discarded: same-F1 band but slower latency (163.04 ms vs best 159.78 ms, epsilon=3.00 ms)
20260501T140118Z	631c8e0d9cf8e720b9694af299ed0015bb68cb18c447f95cc76d42200753b7b1	Edge-Triage-gemma-4-E4B-it-Q3_K_M.gguf	0.9572	156.24	3.83	50	discard	[latv2] EDG-336 r2: probe budget 10 sweep on gpu47/nctx933/batch192 | discarded: F1 below historical best (0.9572 vs 0.9794, epsilon=0.0001)
20260501T140136Z	f5001c3c104211eaa85e088bd68ed94513784241c148490a133492e4d57b3229	Edge-Triage-gemma-4-E4B-it-Q3_K_M.gguf	0.9794	162.27	3.83	50	keep	[latv2] EDG-336 r3: n_gpu_layers=48 micro-sweep on nctx933/batch192/probebudget11
20260501T140257Z	29bd22c5a19c8155767bec14b6244263f71c722294738565df0efe0679850e3f	Edge-Triage-gemma-4-E4B-it-Q3_K_M.gguf	0.9238	160.77	3.84	50	discard	[latv2] EDG-336 r4: short targeted-probe prompts v1 on nctx933/gpu47/batch192 | discarded: F1 below historical best (0.9238 vs 0.9794, epsilon=0.0001)
20260501T140340Z	e7ec3c25ee798e8fb20d93df5dd6edb2d8fdde3ab8d5e7de640a59d7625b33e1	Edge-Triage-gemma-4-E4B-it-Q3_K_M.gguf	0.9794	160.95	3.84	50	keep	[latv2] EDG-336 r5: baseline repeat after r4 rollback (nctx933/gpu47/batch192/budget11)
20260501T160143Z	02d0ae299ae035268661375a53afd8d4165c83b303ce9c68a96b464c6a02e481	Edge-Triage-gemma-4-E4B-it-Q3_K_M.gguf	0.9794	160.36	3.84	50	keep	[latv2] EDG-337 r1: n_ctx=931 micro-sweep on gpu47/batch192/probebudget11
20260501T180059Z	02d0ae299ae035268661375a53afd8d4165c83b303ce9c68a96b464c6a02e481	Edge-Triage-gemma-4-E4B-it-Q3_K_M.gguf	0.9794	266.82	3.84	50	discard	[latv2] EDG-338 r1: n_ctx=931 repeat-1 on gpu47/batch192/probebudget11 | discarded: same-F1 band but slower latency (266.82 ms vs best 159.78 ms, epsilon=3.00 ms)
20260501T180059Z	02d0ae299ae035268661375a53afd8d4165c83b303ce9c68a96b464c6a02e481	Edge-Triage-gemma-4-E4B-it-Q3_K_M.gguf	0.9794	266.81	3.84	50	discard	[latv2] EDG-338 r2: n_ctx=931 repeat-2 on gpu47/batch192/probebudget11 | discarded: same-F1 band but slower latency (266.81 ms vs best 159.78 ms, epsilon=3.00 ms)
20260501T180123Z	d2a3261468aed7822d4e890b3fadbee393f910923d9c280eb852b03de7c27087	Edge-Triage-gemma-4-E4B-it-Q3_K_M.gguf	0.9794	266.92	3.83	50	discard	[latv2] EDG-338 r4: n_ctx=931 sequential repeat-2 on gpu47/batch192/probebudget11 | discarded: same-F1 band but slower latency (266.92 ms vs best 159.78 ms, epsilon=3.00 ms)
20260501T180123Z	02d0ae299ae035268661375a53afd8d4165c83b303ce9c68a96b464c6a02e481	Edge-Triage-gemma-4-E4B-it-Q3_K_M.gguf	0.9794	266.91	3.84	50	discard	[latv2] EDG-338 r3: n_ctx=931 sequential repeat-1 on gpu47/batch192/probebudget11 | discarded: same-F1 band but slower latency (266.91 ms vs best 159.78 ms, epsilon=3.00 ms)
20260501T180142Z	02d0ae299ae035268661375a53afd8d4165c83b303ce9c68a96b464c6a02e481	Edge-Triage-gemma-4-E4B-it-Q3_K_M.gguf	0.9794	163.13	3.83	50	discard	[latv2] EDG-338 r5: n_ctx=931 sequential isolated repeat-1 on gpu47/batch192/probebudget11 | discarded: same-F1 band but slower latency (163.13 ms vs best 159.78 ms, epsilon=3.00 ms)
20260501T180157Z	02d0ae299ae035268661375a53afd8d4165c83b303ce9c68a96b464c6a02e481	Edge-Triage-gemma-4-E4B-it-Q3_K_M.gguf	0.9794	163.81	3.84	50	discard	[latv2] EDG-338 r6: n_ctx=931 sequential isolated repeat-2 on gpu47/batch192/probebudget11 | discarded: same-F1 band but slower latency (163.81 ms vs best 159.78 ms, epsilon=3.00 ms)
20260501T180329Z	b0b4c2f040cb7f8896f0a1e66d6b5724825d4b7e7a04a6898fd2e2908b752be5	Edge-Triage-gemma-4-E4B-it-Q3_K_M.gguf	0.9794	166.59	3.84	50	discard	[latv2] EDG-338 r7: cache compiled keyword regex in contains_keyword (default nctx933/gpu47/batch192/budget11) | discarded: same-F1 band but slower latency (166.59 ms vs best 159.78 ms, epsilon=3.00 ms)
20260501T200137Z	75a9c4e333ff2c6825a91b5d05d0c07bb094c06df1c591d3e95cadf0e0ec5267	Edge-Triage-gemma-4-E4B-it-Q3_K_M.gguf	0.9794	160.59	3.84	50	keep	[latv2] EDG-339 r1: replace regex keyword boundary checks with low-overhead token boundary matching in routing hot path (default nctx933/gpu47/batch192/budget11)
20260501T200239Z	75a9c4e333ff2c6825a91b5d05d0c07bb094c06df1c591d3e95cadf0e0ec5267	Edge-Triage-gemma-4-E4B-it-Q3_K_M.gguf	0.9794	161.75	3.84	50	keep	[latv2] EDG-339 r2: repeat stability run for keyword-boundary hot-path trim (default nctx933/gpu47/batch192/budget11)
20260501T200255Z	75a9c4e333ff2c6825a91b5d05d0c07bb094c06df1c591d3e95cadf0e0ec5267	Edge-Triage-gemma-4-E4B-it-Q3_K_M.gguf	0.9794	162.23	3.84	50	keep	[latv2] EDG-339 r3: repeat stability run for keyword-boundary hot-path trim (default nctx933/gpu47/batch192/budget11)
20260501T220145Z	f0b7228a01b9e28c7c1f6b2c716a1a2d9b4559adfe05a59083dfd1eeaf353d66	Edge-Triage-gemma-4-E4B-it-Q3_K_M.gguf	0.9794	162.19	3.84	50	keep	[latv2] EDG-340 r1: reuse precomputed scenario padding for keyword boundary checks in fast-path matching (default nctx933/gpu47/batch192/budget11)
20260501T220203Z	f0b7228a01b9e28c7c1f6b2c716a1a2d9b4559adfe05a59083dfd1eeaf353d66	Edge-Triage-gemma-4-E4B-it-Q3_K_M.gguf	0.9794	164.40	3.82	50	discard	[latv2] EDG-340 r2: repeat for scenario-padding reuse fast-path matching (default nctx933/gpu47/batch192/budget11) | discarded: same-F1 band but slower latency (164.40 ms vs best 159.78 ms, epsilon=3.00 ms)
20260502T080057Z	75a9c4e333ff2c6825a91b5d05d0c07bb094c06df1c591d3e95cadf0e0ec5267	Edge-Triage-gemma-4-E4B-it-Q3_K_M.gguf	0.0000	0.00	0.00	0	skip	State hash already evaluated. Benchmark skipped.
20260502T080134Z	430e5a3ec04a8503c3ee70e64399e46a5605284a6c9a2888216f9c997a545b97	Edge-Triage-gemma-4-E4B-it-Q3_K_M.gguf	0.9794	267.18	3.85	50	discard	[latv2] EDG-341 r2: repeat stability for guard/hash/VRAM accounting update | discarded: same-F1 band but slower latency (267.18 ms vs best 159.78 ms, epsilon=3.00 ms)
20260502T080134Z	430e5a3ec04a8503c3ee70e64399e46a5605284a6c9a2888216f9c997a545b97	Edge-Triage-gemma-4-E4B-it-Q3_K_M.gguf	0.9794	267.13	3.84	50	discard	[latv2] EDG-341 r1: comparability guard tightening + process VRAM accounting + hash hardening | discarded: same-F1 band but slower latency (267.13 ms vs best 159.78 ms, epsilon=3.00 ms)
20260502T080259Z	430e5a3ec04a8503c3ee70e64399e46a5605284a6c9a2888216f9c997a545b97	Edge-Triage-gemma-4-E4B-it-Q3_K_M.gguf	0.9794	266.23	3.84	50	discard	[latv2] EDG-341 r4: forced variance check repeat on guard/hash baseline | discarded: same-F1 band but slower latency (266.23 ms vs best 159.78 ms, epsilon=3.00 ms)
20260502T080259Z	430e5a3ec04a8503c3ee70e64399e46a5605284a6c9a2888216f9c997a545b97	Edge-Triage-gemma-4-E4B-it-Q3_K_M.gguf	0.9794	266.14	3.84	50	discard	[latv2] EDG-341 r3: forced variance check on guard/hash baseline | discarded: same-F1 band but slower latency (266.14 ms vs best 159.78 ms, epsilon=3.00 ms)
20260502T080346Z	c3f5d3ddaaea585eaa2e0d8dbc4fe6a1566d2e7a9015d3d194f2f634c76e8ab2	Edge-Triage-gemma-4-E4B-it-Q3_K_M.gguf	0.9794	266.85	3.84	50	discard	[latv2] EDG-341 r6: forced micro-sweep n_gpu_layers=48 on guard/hash baseline | discarded: same-F1 band but slower latency (266.85 ms vs best 159.78 ms, epsilon=3.00 ms)
20260502T080346Z	0e1b86042bef33f94e18ee115ba8799c638d025b76b270cc50ada7d22d61c980	Edge-Triage-gemma-4-E4B-it-Q3_K_M.gguf	0.9794	267.30	3.84	50	discard	[latv2] EDG-341 r5: forced micro-sweep n_gpu_layers=46 on guard/hash baseline | discarded: same-F1 band but slower latency (267.30 ms vs best 159.78 ms, epsilon=3.00 ms)
20260502T100137Z	430e5a3ec04a8503c3ee70e64399e46a5605284a6c9a2888216f9c997a545b97	Edge-Triage-gemma-4-E4B-it-Q3_K_M.gguf	0.9794	161.08	3.84	50	keep	[latv2] EDG-342 r1: forced baseline repeat on current edg341 codepath
20260502T100243Z	430e5a3ec04a8503c3ee70e64399e46a5605284a6c9a2888216f9c997a545b97	Edge-Triage-gemma-4-E4B-it-Q3_K_M.gguf	0.9794	160.64	3.84	50	keep	[latv2] EDG-342 r2: forced repeat stability check on current edg341 codepath
20260502T100258Z	430e5a3ec04a8503c3ee70e64399e46a5605284a6c9a2888216f9c997a545b97	Edge-Triage-gemma-4-E4B-it-Q3_K_M.gguf	0.9794	161.25	3.83	50	keep	[latv2] EDG-342 r3: forced repeat stability check on current edg341 codepath
20260502T100315Z	a57e8ebc8497559426c98963c91a88c16057f141207fbef20aa980182daf6cf5	Edge-Triage-gemma-4-E4B-it-Q3_K_M.gguf	0.9794	163.65	3.84	50	discard	[latv2] EDG-342 r4: n_ctx=931 micro-sweep on stable edg341 baseline | discarded: same-F1 band but slower latency (163.65 ms vs best 159.78 ms, epsilon=3.00 ms)
20260502T120109Z	c880fbb2f1dbf557c14286bb1d9ad7caa658d8acd2d613e7cf29b25ee551a64b	Edge-Triage-gemma-4-E4B-it-Q3_K_M.gguf	0.0000	0.00	0.00	0	blocked	EDG-343 r1: default LLAMA_N_BATCH 200 micro-sweep on stable edg341 baseline | blocked: runtime reduced GPU layers for low-VRAM safety; skipped non-comparable benchmark (using 4/47 layers). Free more VRAM or set TRIAGE_ALLOW_REDUCED_GPU_BENCHMARK=1 to force diagnostic runs.
20260502T120236Z	22672bd43804994bcb4add986d6d13447f675c650ccc766b67e93551fbb32efd	Edge-Triage-gemma-4-E4B-it-Q3_K_M.gguf	0.9416	1014.77	1.77	50	discard	[latv2] EDG-343 r1c: default LLAMA_N_BATCH 200 micro-sweep under runtime reduced-gpu safety mode | discarded: F1 below historical best (0.9416 vs 0.9794, epsilon=0.0001)
20260502T120533Z	430e5a3ec04a8503c3ee70e64399e46a5605284a6c9a2888216f9c997a545b97	Edge-Triage-gemma-4-E4B-it-Q3_K_M.gguf	0.0000	0.00	0.00	0	blocked	EDG-343 r2: low-vram duplicate-block suppression check run1 | blocked: runtime reduced GPU layers for low-VRAM safety; skipped non-comparable benchmark (using 4/47 layers). Free more VRAM or set TRIAGE_ALLOW_REDUCED_GPU_BENCHMARK=1 to force diagnostic runs.
20260502T140121Z	430e5a3ec04a8503c3ee70e64399e46a5605284a6c9a2888216f9c997a545b97	Edge-Triage-gemma-4-E4B-it-Q3_K_M.gguf	0.9794	169.42	3.84	50	discard	[latv2] EDG-344 r1: retry LLAMA_N_BATCH=200 micro-sweep after clearing stale VRAM holder | discarded: same-F1 band but slower latency (169.42 ms vs best 160.36 ms, epsilon=3.00 ms)
20260502T140138Z	430e5a3ec04a8503c3ee70e64399e46a5605284a6c9a2888216f9c997a545b97	Edge-Triage-gemma-4-E4B-it-Q3_K_M.gguf	0.9794	162.65	3.84	50	keep	[latv2] EDG-344 r2: repeat LLAMA_N_BATCH=200 micro-sweep after clearing stale VRAM holder
20260502T140223Z	430e5a3ec04a8503c3ee70e64399e46a5605284a6c9a2888216f9c997a545b97	Edge-Triage-gemma-4-E4B-it-Q3_K_M.gguf	0.9794	270.16	3.84	50	discard	[latv2] EDG-344 r4: variance repeat LLAMA_N_BATCH=200 after VRAM cleanup | discarded: same-F1 band but slower latency (270.16 ms vs best 160.36 ms, epsilon=3.00 ms)
20260502T140223Z	430e5a3ec04a8503c3ee70e64399e46a5605284a6c9a2888216f9c997a545b97	Edge-Triage-gemma-4-E4B-it-Q3_K_M.gguf	0.9794	270.37	3.84	50	discard	[latv2] EDG-344 r3: variance repeat LLAMA_N_BATCH=200 after VRAM cleanup | discarded: same-F1 band but slower latency (270.37 ms vs best 160.36 ms, epsilon=3.00 ms)
